Symbol,Name,Last Sale,Net Change,% Change,Market Cap,Country,IPO Year,Volume,Sector,Industry
IPOE,Social Capital Hedosophia Holdings Corp. V Class A Ordinary Shares,$16.475,-0.205,-1.229%,1657796875.00,United States,2020,1795837,Finance,Investment Bankers/Brokers/Service
IPOF,Social Capital Hedosophia Holdings Corp. VI Class A Ordinary Shares,$10.47,-0.08,-0.758%,1505062500.00,United States,2020,1542117,Finance,Business Services
IQI,Invesco Quality Municipal Income Trust Common Stock,$13.205,0.025,0.19%,698330539.00,United States,,68083,,
IQV,IQVIA Holdings Inc. Common Stock,$215.65,6.75,3.231%,41354579428.00,United States,2013,484958,Health Care,Biotechnology: Commercial Physical & Biological Resarch
IR,Ingersoll Rand Inc. Common Stock,$49.41,0.01,0.02%,20691163580.00,United States,2017,1039553,Technology,Industrial Machinery/Components
IRL,New Ireland Fund Inc (The) Common Stock,$12.90,0.01,0.078%,63452597.00,United States,1990,2173,,
IRM,Iron Mountain Incorporated (Delaware)Common Stock REIT,$37.89,-0.10,-0.263%,10939342352.00,United States,,891701,Consumer Services,Real Estate Investment Trusts
IRR,Voya Natural Resources Equity Income Fund Common Shares of Beneficial Interest,$3.3401,0.0301,0.909%,74644187.00,United States,,144061,,
IRS,IRSA Inversiones Y Representaciones S.A. Common Stock,$3.9301,-0.1499,-3.674%,227425636.00,Argentina,,43414,Consumer Services,Homebuilding
IRT,Independence Realty Trust Inc. Common Stock,$16.095,0.065,0.405%,1642292307.00,United States,2013,300400,Consumer Services,Real Estate Investment Trusts
ISD,PGIM High Yield Bond Fund Inc.,$15.90,-0.09,-0.563%,528781928.00,United States,2012,74779,,
IT,Gartner Inc. Common Stock,$190.82,2.21,1.172%,16929845789.00,United States,1993,186392,Consumer Services,Other Consumer Services
ITCB,Itau CorpBanca American Depositary Shares (each representing 1500 shares of Common Stock no par value),$5.90,-0.08,-1.338%,2015466585.00,Chile,,7700,Finance,Commercial Banks
ITGR,Integer Holdings Corporation Common Stock,$94.08,2.57,2.808%,3102245570.00,United States,,59885,Miscellaneous,Industrial Machinery/Components
ITT,ITT Inc. Common Stock ,$91.53,-0.18,-0.196%,7876518776.00,United States,2011,295461,Capital Goods,Fluid Controls
ITUB,Itau Unibanco Banco Holding SA American Depositary Shares (Each repstg 500 Preferred shares),$4.865,-0.005,-0.103%,47494352799.00,Brazil,,26050984,Finance,Major Banks
ITW,Illinois Tool Works Inc. Common Stock,$221.24,-0.38,-0.171%,70018094271.00,United States,,642203,Technology,Industrial Machinery/Components
IVAN,Ivanhoe Capital Acquisition Corp. Class A Ordinary Shares,$10.16,-0.09,-0.878%,350520000.00,,2021,109967,Finance,Business Services
IVC,Invacare Corporation Common Stock,$8.8879,0.3979,4.687%,309497805.00,United States,,255811,Health Care,Industrial Specialties
IVH,Ivy High Income Opportunities Fund Common Shares of Beneficial Interest,$13.6558,-0.0242,-0.177%,226279815.00,,2013,64845,,
IVR,INVESCO MORTGAGE CAPITAL INC Common Stock,$3.825,-0.045,-1.163%,882992491.00,United States,2009,3549048,Consumer Services,Real Estate Investment Trusts
IVR^A,Invesco Mortgage Capital Inc. Pfd Ser A,$24.685,0.085,0.346%,,United States,,6876,,
IVR^B,Invesco Mortgage Capital Inc. Preferred Series B Cum Fxd to Fltg,$24.685,-0.115,-0.464%,,United States,,42313,,
IVR^C,INVESCO MORTGAGE CAPITAL INC 7.5% Fixed-to-Floating Series C Cumulative Redeemable Preferred Stock Liquation Preference $25.00 per Share,$24.0998,0.0498,0.207%,,United States,,16456,,
IVZ,Invesco Ltd Common Stock,$26.835,0.715,2.737%,12378450276.00,United States,,2633495,Finance,Investment Managers
IX,Orix Corp Ads Common Stock,$84.06,0.46,0.55%,20502109927.00,Japan,,9233,Finance,Diversified Financial Services
J,Jacobs Engineering Group Inc. Common Stock,$133.57,2.25,1.713%,17375608525.00,United States,,575121,Basic Industries,Military/Government/Technical
JAX,J. Alexander's Holdings Inc. Common Stock,$10.07,0.00,0.00%,151957075.00,,2015,19904,Consumer Services,Restaurants
JBGS,JBG SMITH Properties Common Shares ,$32.25,0.19,0.593%,4239970613.00,United States,2017,102591,Consumer Services,Real Estate Investment Trusts
JBK,Lehman ABS 3.50 3.50% Adjustable Corp Backed Tr Certs GS Cap I,$28.91,0.00,0.00%,0.00,United States,,34,Finance,Finance: Consumer Services
JBL,Jabil Inc. Common Stock,$53.85,-0.20,-0.37%,8012770308.00,United States,1993,379873,Technology,Electrical Products
JBT,John Bean Technologies Corporation Common Stock,$135.60,0.47,0.348%,4302615934.00,United States,,31529,Technology,Industrial Machinery/Components
JCE,Nuveen Core Equity Alpha Fund Nuveen Core Equity Alpha Fund Common Shares of Beneficial Interest,$15.87,0.10,0.634%,254384689.00,United States,2007,34708,,
JCI,Johnson Controls International plc Ordinary Share,$61.885,0.495,0.806%,44456408396.00,Switzerland,,1185485,Consumer Services,Other Consumer Services
JCO,Nuveen Credit Opportunities 2022 Target Term Fund Common Shares of Beneficial Interest,$8.5146,0.0246,0.29%,236284339.00,United States,2017,26178,,
JDD,Nuveen Diversified Dividend and Income Fund Shares of Beneficial Interest,$9.9836,0.0036,0.036%,196362606.00,United States,2003,56201,,
JEF,Jefferies Financial Group Inc. Common Stock,$31.9931,0.0631,0.198%,7901412466.00,United States,,908560,Finance,Investment Bankers/Brokers/Service
JELD,JELD-WEN Holding Inc. Common Stock,$30.05,0.14,0.468%,3006077323.00,United States,2017,197417,Basic Industries,Forest Products
JEMD,Nuveen Emerging Markets Debt 2022 Target Term Fund Common Shares of Beneficial Interest $0.01 par value per share,$8.1741,-0.0059,-0.072%,116456337.00,,2017,26207,,
JEQ,Aberdeen Japan Equity Fund Inc.  Common Stock,$9.31,0.03,0.323%,124833470.00,United States,1992,10035,,
JFR,Nuveen Floating Rate Income Fund Common Stock,$9.64,0.02,0.208%,548694032.00,United States,2004,174743,,
JGH,Nuveen Global High Income Fund Common Shares of Beneficial Interest,$15.71,0.09,0.576%,364116844.00,United States,2014,25913,,
JHAA,Nuveen Corporate Income 2023 Target Term Fund,$10.02,0.01,0.10%,78411099.00,,2018,3264,,
JHB,Nuveen Corporate Income November 2021 Target Term Fund,$9.40,0.00,0.00%,525460461.00,,2016,132064,,
JHG,Janus Henderson Group plc Ordinary Shares,$33.29,0.89,2.747%,5737531134.00,,2017,534553,Finance,Investment Managers
JHI,John Hancock Investors Trust Common Stock,$18.56,0.07,0.379%,161602384.00,United States,,4521,,
JHS,John Hancock Income Securities Trust Common Stock,$15.365,0.045,0.294%,178949763.00,United States,,10741,,
JHX,James Hardie Industries plc American Depositary Shares (Ireland),$33.83,1.28,3.932%,15026186153.00,Ireland,,18156,Capital Goods,Building Materials
JIH,Juniper Industrial Holdings Inc. Class A Common Stock,$13.63,-0.24,-1.73%,587793750.00,,2019,209892,Finance,Business Services
JILL,J. Jill Inc. Common Stock,$8.18,0.22,2.764%,78786758.00,,2017,140028,Consumer Non-Durables,Apparel
JKS,JinkoSolar Holding Company Limited American Depositary Shares (each representing 4 Common Shares),$35.42,-1.14,-3.118%,1604308132.00,China,2010,1236286,Technology,Semiconductors
JLL,Jones Lang LaSalle Incorporated Common Stock,$179.30,-0.33,-0.184%,9164161061.00,United States,,236158,Finance,Real Estate
JLS,Nuveen Mortgage and Income Fund,$21.35,0.09,0.423%,117156844.00,United States,2009,27011,,
JMIA,Jumia Technologies AG American Depositary Shares each representing two Ordinary Shares,$34.27,-0.88,-2.504%,3378767854.00,,2019,3743399,Consumer Services,Catalog/Specialty Distribution
JMM,Nuveen Multi-Market Income Fund (MA),$7.31,0.04,0.55%,69169786.00,United States,,5179,,
JMP,JMP Group LLC Common Shares,$6.53,-0.22,-3.259%,129446502.00,United States,2007,47355,Finance,Investment Bankers/Brokers/Service
JNJ,Johnson & Johnson Common Stock,$160.65,0.73,0.456%,422944310471.00,United States,,4549620,Health Care,Major Pharmaceuticals
JNPR,Juniper Networks Inc. Common Stock,$25.645,0.055,0.215%,8388083490.00,United States,1999,1516588,Technology,Computer Communications Equipment
JOE,St. Joe Company (The) Common Stock,$45.84,1.05,2.344%,2699176046.00,United States,,78475,Consumer Services,Homebuilding
JOF,Japan Smaller Capitalization Fund Inc Common Stock,$9.49,0.05,0.53%,268888645.00,United States,1990,45153,,
JP,Jupai Holdings Limited American Depositary Shares each representing six ordinary shares,$2.06,-0.15,-6.787%,69451493.00,,2015,76260,Consumer Services,Other Consumer Services
JPC,Nuveen Preferred & Income Opportunities Fund,$9.55,0.06,0.632%,987041673.00,United States,2003,172915,,
JPI,Nuveen Preferred and Income Term Fund Common Shares of Beneficial Interest,$25.29,0.01,0.04%,575635578.00,,2012,23772,,
JPM,JP Morgan Chase & Co. Common Stock,$151.575,0.365,0.241%,459591795716.00,United States,,12311673,Finance,Major Banks
JPM^C,J P Morgan Chase & Co Depositary Shares each representing a 1/400th interest in a share of 6.00% Non-Cumulative  Preferred Stock Series EE,$27.97,0.12,0.431%,,United States,,117430,,
JPM^D,J P Morgan Chase & Co Depositary Shares each representing a 1/400th  interest in a share of 5.75% Non-Cumulative  Preferred Stock Series DD,$27.64,0.10,0.363%,,United States,,80985,,
JPM^G,J P Morgan Chase & Co Depositary Shares each representing a 1/400th interest in a share of 6.10% Non-Cumulative Preferred Stock Series AA,$25.70,0.07,0.273%,,United States,,75256,,
JPM^H,J P Morgan Chase & Co Depositary Shares each representing a 1/400th interest in a share of 6.15% Non-Cumulative Preferred Stock Series BB,$25.61,0.04,0.156%,,United States,,67290,Finance,Major Banks
JPM^J,J P Morgan Chase & Co Depositary Shares each representing a 1/400th interest in a share of JPMorgan Chase & Co. 4.75% Non-Cumulative Preferred Stock Series GG,$26.605,0.065,0.245%,,United States,,32515,Finance,Major Banks
JPM^K,J P Morgan Chase & Co Depositary Shares each representing a 1/400th interest in a share of 4.55% Non-Cumulative Preferred Stock Series JJ,$25.96,0.05,0.193%,,United States,,264389,,
JPS,Nuveen Preferred & Income Securities Fund,$9.81,0.09,0.926%,1999181342.00,United States,2002,242027,,
JPT,Nuveen Preferred and Income 2022 Term Fund Common Shares of Beneficial Interest,$24.50,0.02,0.082%,167606264.00,United States,2017,5455,,
JQC,Nuveen Credit Strategies Income Fund Shares of Beneficial Interest,$6.61,0.02,0.303%,896377407.00,United States,2003,458139,,
JRI,Nuveen Real Asset Income and Growth Fund Common Shares of Beneficial Interest,$15.265,0.135,0.892%,419080425.00,United States,2012,146766,,
JRO,Nuveen Floating Rate Income Opportuntiy Fund Shares of Beneficial Interest,$9.5116,0.0216,0.228%,385611849.00,United States,2004,88113,,
JRS,Nuveen Real Estate Income Fund Common Shares of Beneficial Interest,$9.99,0.19,1.939%,288635785.00,United States,2001,39995,,
JSD,Nuveen Short Duration Credit Opportunities Fund Common Shares of Beneficial Interest,$14.2034,-0.0066,-0.046%,143250493.00,United States,2011,59837,,
JT,Jianpu Technology Inc. American depositary shares,$2.40,-0.15,-5.882%,50722046.00,,2017,117670,Technology,Computer Software: Programming Data Processing
JTA,Nuveen Tax-Advantaged Total Return Strategy Fund Common Share of Beneficial Interest,$10.97,-0.02,-0.182%,151944340.00,United States,2004,25584,,
JTD,Nuveen Tax-Advantaged Dividend Growth Fund Common Shares of Beneficial Interest,$15.3699,0.0199,0.13%,222622857.00,United States,,33962,,
JW/A,John Wiley & Sons Inc.,$56.80,0.54,0.96%,,United States,,80990,,
JW/B,John Wiley & Sons Inc.,$56.94,0.88,1.57%,,United States,,105,,
JWN,Nordstrom Inc. Common Stock,$36.09,-1.04,-2.801%,5693933014.00,United States,,2643167,Consumer Services,Clothing/Shoe/Accessory Stores
JWS,Jaws Acquisition Corp. Class A Ordinary Shares,$13.30,-0.17,-1.262%,1147125000.00,,2020,242594,Health Care,Medical/Nursing Services
JWSM,Jaws Mustang Acquisition Corp. Class A Ordinary Shares,$9.98,0.01,0.10%,1291162500.00,,2021,117963,Finance,Business Services
K,Kellogg Company Common Stock,$62.93,0.35,0.559%,21418565322.00,United States,,1280660,Consumer Non-Durables,Packaged Foods
KAI,Kadant Inc Common Stock,$181.08,0.55,0.305%,2096504402.00,United States,,9146,Technology,Industrial Machinery/Components
KAMN,Kaman Corporation Common Stock,$52.81,-0.01,-0.019%,1464482243.00,United States,,22235,Capital Goods,Military/Government/Technical
KAR,KAR Auction Services Inc Common Stock,$15.03,-0.15,-0.988%,1949421120.00,United States,2009,1579563,Consumer Durables,Automotive Aftermarket
KB,KB Financial Group Inc,$47.93,0.37,0.778%,18914823677.00,South Korea,,80804,Finance,Commercial Banks
KBH,KB Home Common Stock,$48.25,0.03,0.062%,4764093543.00,United States,1986,362511,Capital Goods,Homebuilding
KBR,KBR Inc. Common Stock,$39.635,0.425,1.084%,5597360644.00,United States,2006,805831,Basic Industries,Military/Government/Technical
KEN,Kenon Holdings Ltd. Ordinary Shares,$31.9341,0.0541,0.17%,1720326979.00,Singapore,2015,943,Public Utilities,Electric Utilities: Central
KEP,Korea Electric Power Corporation Common Stock,$10.79,0.06,0.559%,13853584782.00,South Korea,1994,201542,Public Utilities,Electric Utilities: Central
KEX,Kirby Corporation Common Stock,$61.61,-0.80,-1.282%,3701902403.00,United States,,137034,Consumer Services,Marine Transportation
KEY,KeyCorp Common Stock,$20.507,-0.293,-1.409%,19687919906.00,United States,,4691388,Finance,Major Banks
KEY^I,KeyCorp Depositary Shares Each Representing a 1/40th Ownership Interest in a Share of Fixed-to-Floating Rate Perpetual Non-Cumulative Preferred Stock Series E,$30.565,0.065,0.213%,,United States,,16379,,
KEY^J,KeyCorp Depositary Shares each representing a 1/40th ownership interest in a share of Fixed Rate Perpetual Non-Cumulative Preferred Stock Series F,$27.58,0.10,0.364%,,United States,,7104,,
KEY^K,KeyCorp Depositary Shares each representing a 1/40th ownership interest in a share of Fixed Rate Perpetual Non-Cumulative Preferred Stock Series G,$28.09,0.03,0.107%,,United States,,16545,,
KEYS,Keysight Technologies Inc. Common Stock,$144.84,1.42,0.99%,26939433531.00,United States,2014,448822,Capital Goods,Industrial Machinery/Components
KF,Korea Fund Inc. (The) New Common Stock,$45.20,0.24,0.534%,226902915.00,United States,,10337,,
KFS,Kingsway Financial Services Inc. Common Stock (DE),$4.60,0.03,0.656%,104470917.00,Canada,,3739,Finance,Property-Casualty Insurers
KFY,Korn Ferry Common Stock,$64.91,0.33,0.511%,3505579376.00,United States,1999,66716,Technology,Diversified Commercial Services
KGC,Kinross Gold Corporation Common Stock,$7.49,0.33,4.609%,9445341774.00,Canada,,11638370,Basic Industries,Precious Metals
KIM,Kimco Realty Corporation Common Stock,$19.845,0.365,1.874%,8601641051.00,United States,,11144244,Consumer Services,Real Estate Investment Trusts
KIM^L,Kimco Realty Corporation Class L Depositary Shares each of which represents a one-one thousandth fractional interest in a share of 5.125% Class L Cumulative Redeemable Preferred Stock liquidation preference $25000.00 per share,$26.6671,0.0371,0.139%,,United States,,3064,,
KIM^M,Kimco Realty Corporation Class M Depositary Shares each of which represents a one-one thousandth fractional interest in a share of 5.25% Class M Cumulative Redeemable Preferred Stock liquidation preference $25000.00 per share,$26.68,0.00,0.00%,,United States,,67319,,
KIO,KKR Income Opportunities Fund Common Shares,$15.88,0.06,0.379%,323004202.00,,2013,41089,,
KKR,KKR & Co. Inc. Common Stock,$52.98,-0.13,-0.245%,30548859999.00,United States,,1229153,Finance,Investment Managers
KKR^A,KKR & Co. Inc. 6.75% Series A Preferred Stock,$25.82,0.16,0.624%,,United States,,20480,,
KKR^B,KKR & Co. Inc. 6.50% Series B Preferred Stock,$25.676,-0.0139,-0.054%,,United States,,31626,,
KKR^C,KKR & Co. Inc. 6.00% Series C Mandatory Convertible Preferred Stock,$71.3597,-0.2903,-0.405%,,United States,,148129,,
KL,Kirkland Lake Gold Ltd. Common Shares,$37.43,1.26,3.484%,9995891183.00,,,1466261,Basic Industries,Precious Metals
KMB,Kimberly-Clark Corporation Common Stock,$138.4899,2.2199,1.629%,46810516160.00,United States,,1455928,Consumer Durables,Containers/Packaging
KMF,Kayne Anderson NextGen Energy & Infrastructure Inc.,$6.77,0.06,0.894%,319526818.00,,2010,111239,,
KMI,Kinder Morgan Inc. Common Stock,$16.71,0.06,0.36%,37840672074.00,United States,2011,7315275,Public Utilities,Natural Gas Distribution
KMPR,Kemper Corporation,$82.62,-0.50,-0.602%,5419433949.00,United States,,81113,Finance,Property-Casualty Insurers
KMT,Kennametal Inc. Common Stock,$41.69,-0.35,-0.833%,3482490895.00,United States,,153311,Capital Goods,Industrial Machinery/Components
KMX,CarMax Inc,$128.65,-0.97,-0.748%,20992120640.00,United States,,459143,Consumer Durables,Automotive Aftermarket
KN,Knowles Corporation Common Stock,$21.04,0.00,0.00%,1950268652.00,,2014,301470,Consumer Non-Durables,Consumer Electronics/Appliances
KNL,Knoll Inc. Common Stock,$16.95,-0.07,-0.411%,836972558.00,United States,2004,41571,Consumer Durables,Office Equipment/Supplies/Services
KNOP,KNOT Offshore Partners LP Common Units representing Limited Partner Interests,$18.36,-0.06,-0.326%,600263566.00,United Kingdom,2013,131971,Consumer Services,Marine Transportation
KNX,Knight-Swift Transportation Holdings Inc.,$50.15,0.42,0.845%,8298742262.00,United States,2017,731067,Transportation,Trucking Freight/Courier Services
KO,Coca-Cola Company (The) Common Stock,$53.345,0.265,0.499%,229880231356.00,United States,,7464229,Consumer Non-Durables,Beverages (Production/Distribution)
KODK,Eastman Kodak Company Common New,$7.29,-0.07,-0.951%,572290340.00,United States,,1638714,Miscellaneous,Industrial Machinery/Components
KOF,Coca Cola Femsa S.A.B. de C.V.  American Depositary Shares each representing 10 Units (each Unit consists of 3 Series B Shares and 5 Series L Shares),$47.95,0.01,0.021%,10073490687.00,Mexico,1993,148568,Consumer Non-Durables,Beverages (Production/Distribution)
KOP,Koppers Holdings Inc. Koppers Holdings Inc. Common Stock,$34.19,0.33,0.975%,726052241.00,United States,2006,46153,Basic Industries,Forest Products
KOS,Kosmos Energy Ltd. Common Shares (DE),$2.785,-0.085,-2.962%,1135844212.00,Bermuda,2011,2179485,Energy,Oil & Gas Production
KR,Kroger Company (The) Common Stock,$37.065,-0.175,-0.47%,27872646528.00,United States,,4288011,Consumer Services,Food Chains
KRA,Kraton Corporation Common Stock,$37.71,0.26,0.694%,1212152012.00,United States,2009,76750,Basic Industries,Major Chemicals
KRC,Kilroy Realty Corporation Common Stock,$66.88,-0.65,-0.963%,7788200746.00,United States,1997,357190,Consumer Services,Real Estate Investment Trusts
KREF,KKR Real Estate Finance Trust Inc. Common Stock,$19.64,-0.05,-0.254%,1092365566.00,United States,2017,130526,Consumer Services,Real Estate Investment Trusts
KRG,Kite Realty Group Trust Common Stock,$19.98,0.39,1.991%,1688033916.00,United States,2004,118245,Consumer Services,Real Estate Investment Trusts
KRO,Kronos Worldwide Inc Common Stock,$16.425,0.205,1.264%,1897789127.00,United States,,85887,Basic Industries,Major Chemicals
KRP,Kimbell Royalty Partners Common Units Representing Limited Partner Interests,$10.35,0.32,3.19%,621850335.00,United States,2017,61750,Energy,Oil & Gas Production
KSM,DWS Strategic Municipal Income Trust,$11.96,-0.01,-0.084%,133999134.00,United States,1989,9687,,
KSS,Kohl's Corporation Common Stock,$59.43,-0.29,-0.486%,9365730417.00,United States,1992,2221107,Consumer Services,Department/Specialty Retail Stores
KSU,Kansas City Southern Common Stock,$258.86,-2.07,-0.793%,23539852418.00,United States,,840087,Transportation,Railroads
KSU^,Kansas City Southern Preferred Stock,$37.62,0.11,0.293%,,United States,,290,Transportation,Railroads
KT,KT Corporation Common Stock,$12.71,0.33,2.666%,6044838988.00,South Korea,,630034,Public Utilities,Telecommunications Equipment
KTB,Kontoor Brands Inc. Common Stock ,$61.1427,1.7727,2.986%,3507881797.00,,2019,225084,Consumer Non-Durables,Apparel
KTF,DWS Municipal Income Trust,$11.8533,-0.0167,-0.141%,468216468.00,United States,1988,36850,,
KTH,Structures Products Cp 8% CorTS Issued by Peco Energy Cap Tr II Preferred Stock,$33.83,0.03,0.089%,0.00,United States,,938,Finance,Finance: Consumer Services
KUKE,Kuke Music Holding Limited American Depositary Shares each representing one Ordinary Share,$6.39,-0.10,-1.541%,188931360.00,,2021,28365,Consumer Services,Other Consumer Services
KW,Kennedy-Wilson Holdings Inc. Common Stock,$20.68,0.10,0.486%,2917625123.00,United States,,119708,Finance,Real Estate
KWAC,Kingswood Acquisition Corp. Class A Common Stock,$10.07,-0.03,-0.297%,145803530.00,,2021,1758,Finance,Business Services
KWR,Quaker Chemical Corporation Common Stock,$243.98,-0.77,-0.315%,4367954178.00,United States,,9944,Basic Industries,Major Chemicals
KYN,Kayne Anderson Energy Infrastructure Fund Inc.,$7.39,0.12,1.651%,934447424.00,United States,2004,560481,,
L,Loews Corporation Common Stock,$54.04,0.02,0.037%,14258996994.00,United States,,165584,Finance,Property-Casualty Insurers
LAC,Lithium Americas Corp. Common Shares,$13.9875,-0.6025,-4.13%,1670449285.00,Canada,,2870476,Basic Industries,Precious Metals
LAD,Lithia Motors Inc. Common Stock,$391.85,-0.36,-0.092%,10514266536.00,United States,,179704,Consumer Durables,Automotive Aftermarket
LADR,Ladder Capital Corp Class A Common Stock,$11.585,0.015,0.13%,1469276430.00,,2014,361262,Consumer Services,Real Estate Investment Trusts
LAIX,LAIX Inc. American Depositary Shares each  representing one Class A Ordinary Share,$2.25,0.10,4.651%,111177524.00,,2018,1806249,Consumer Services,Other Consumer Services
LAZ,Lazard LTD. Lazard LTD. Class A Common Stock,$45.2499,-0.3201,-0.702%,4857283229.00,Bermuda,2005,324576,Finance,Investment Managers
LB,L Brands Inc.,$67.04,0.24,0.359%,18697312065.00,United States,,1710684,Consumer Services,Clothing/Shoe/Accessory Stores
LBRT,Liberty Oilfield Services Inc. Class A Common Stock,$11.51,-0.07,-0.604%,2066516392.00,United States,2018,274855,Energy,Oilfield Services/Equipment
LC,LendingClub Corporation Common Stock,$14.86,0.04,0.27%,1390156254.00,United States,2014,1031187,Finance,Finance: Consumer Services
LCI,Lannett Co Inc Common Stock,$4.845,-0.135,-2.711%,200591382.00,United States,,317750,Health Care,Major Pharmaceuticals
LCII,LCI Industries,$139.06,-2.79,-1.967%,3511655480.00,United States,,43874,Capital Goods,Auto Parts:O.E.M.
LDI,loanDepot Inc. Class A Common Stock,$19.82,-0.16,-0.801%,6052505089.00,,2021,154596,Finance,Finance: Consumer Services
LDL,Lydall Inc. Common Stock,$31.69,-0.13,-0.409%,571179831.00,United States,,37978,Capital Goods,Auto Parts:O.E.M.
LDOS,Leidos Holdings Inc. Common Stock,$101.28,1.17,1.169%,14315549820.00,United States,,716826,Technology,EDP Services
LDP,Cohen & Steers Limited Duration Preferred and Income Fund Inc.,$26.62,-0.09,-0.337%,769953978.00,United States,2012,21215,,
LEA,Lear Corporation Common Stock,$180.59,0.71,0.395%,10858819814.00,United States,,130231,Capital Goods,Auto Parts:O.E.M.
LEAF,Leaf Group Ltd. Common Stock,$9.20,0.13,1.433%,331169493.00,United States,,206427,Technology,EDP Services
LEAP,Ribbit LEAP Ltd. Class A Ordinary Shares,$11.2151,-0.0749,-0.663%,656139426.00,United States,2020,17348,Finance,Business Services
LEE,Lee Enterprises Incorporated Common Stock,$29.08,-0.02,-0.069%,170887253.00,United States,,24299,Consumer Services,Newspapers/Magazines
LEG,Leggett & Platt Incorporated Common Stock,$48.25,0.30,0.626%,6424746168.00,United States,,425792,Consumer Durables,Home Furnishings
LEJU,Leju Holdings Limited American Depositary Shares each representing one Ordinary share,$2.165,-0.015,-0.688%,295145833.00,,2014,35610,Finance,Real Estate
LEN,Lennar Corporation Class A Common Stock,$102.97,-0.07,-0.068%,32268904691.00,United States,,1361317,Basic Industries,Homebuilding
LEO,BNY Mellon Strategic Municipals Inc. Common Stock,$8.70,0.05,0.578%,541224929.00,United States,1987,41415,,
LEVI,Levi Strauss & Co Class A Common Stock,$27.64,0.41,1.506%,11066072845.00,United States,2019,1207411,Consumer Non-Durables,Apparel
LFC,China Life Insurance Company Limited American Depositary Shares,$10.0794,-0.1106,-1.085%,56978253515.00,China,2003,275789,Finance,Life Insurance
LFT,Lument Finance Trust Inc. Common Stock,$3.73,-0.01,-0.267%,93038819.00,United States,2013,53177,Consumer Services,Real Estate Investment Trusts
LGI,Lazard Global Total Return and Income Fund Common Stock,$19.98,0.03,0.15%,259933027.00,United States,2004,20687,,
LH,Laboratory Corporation of America Holdings Common Stock,$259.035,5.915,2.337%,25292400429.00,United States,,407421,Health Care,Medical Specialities
LHC,Leo Holdings Corp. II Class A Ordinary Shares,$9.91,0.00,0.00%,464531250.00,,2021,1,Finance,Business Services
LHX,L3Harris Technologies Inc. Common Stock,$211.72,2.73,1.306%,43522387365.00,United States,,555082,Capital Goods,Industrial Machinery/Components
LII,Lennox International Inc. Common Stock,$328.56,0.33,0.101%,12409021224.00,United States,1999,82296,Capital Goods,Industrial Machinery/Components
LIN,Linde plc Ordinary Share,$287.755,2.705,0.949%,150448795476.00,,2018,702187,Basic Industries,Major Chemicals
LINX,Linx S.A. American Depositary Shares each representing one common share,$6.74,0.51,8.186%,1184172323.00,,2019,14902,Technology,Computer Software: Prepackaged Software
LITB,LightInTheBox Holding Co. Ltd. American Depositary Shares each representing 2 ordinary shares,$2.94,0.24,8.889%,328620193.00,China,2013,589844,Consumer Services,Catalog/Specialty Distribution
LL,Lumber Liquidators Holdings Inc Common Stock,$26.125,0.495,1.931%,757270040.00,United States,2007,190012,Consumer Services,RETAIL: Building Materials
LLY,Eli Lilly and Company Common Stock,$185.82,2.82,1.541%,178199922985.00,United States,,1750507,Health Care,Major Pharmaceuticals
LMND,Lemonade Inc. Common Stock,$89.005,0.405,0.457%,5454390258.00,United States,2020,1273349,Finance,Property-Casualty Insurers
