Symbol,Name,Last Sale,Net Change,% Change,Market Cap,Country,IPO Year,Volume,Sector,Industry
CTT,CatchMark Timber Trust Inc. Class A Common Stock,$11.268,0.298,2.716%,549488640.00,United States,2013,175754,Consumer Services,Real Estate Investment Trusts
CTVA,Corteva Inc. Common Stock ,$47.48,0.26,0.551%,35165496561.00,,2019,1269428,Consumer Non-Durables,Farming/Seeds/Milling
CUB,Cubic Corporation Common Stock,$74.84,-0.02,-0.027%,2376389506.00,United States,,74701,Capital Goods,Industrial Machinery/Components
CUBB,Customers Bancorp Inc 5.375% Subordinated Notes Due 2034,$25.97,-0.23,-0.878%,0.00,United States,2019,1200,Finance,Major Banks
CUBE,CubeSmart Common Shares,$40.47,0.35,0.872%,8106853636.00,United States,,355836,Consumer Services,Real Estate Investment Trusts
CUBI,Customers Bancorp Inc Common Stock,$31.99,0.03,0.094%,1031317964.00,United States,,70780,Finance,Major Banks
CUBI^C,Customers Bancorp Inc Fixed-to-Floating Rate Non-Cumulative Perpetual Preferred Stock Series C,$25.393,0.143,0.566%,,United States,,2555,,
CUBI^D,Customers Bancorp Inc Fixed-to-Floating Rate Non-Cumulative Perpetual Preferred Stock Series D,$25.05,-0.27,-1.066%,,United States,,28328,,
CUBI^E,Customers Bancorp Inc Fixed-to-Floating Rate Non-Cumulative Perpetual Preferred Stock Series E,$25.07,0.04,0.16%,,United States,,2100,,
CUBI^F,Customers Bancorp Inc Fixed-to-Floating Rate Non-Cumulative Perpetual Preferred Stock Series F,$24.91,-0.08,-0.32%,,United States,,30053,,
CUK,Carnival Plc ADS ADS,$23.38,-0.45,-1.888%,26045858582.00,United States,,994339,Consumer Services,Marine Transportation
CULP,Culp Inc. Common Stock,$14.18,-0.22,-1.528%,174532502.00,United States,,9430,Basic Industries,Textiles
CURO,CURO Group Holdings Corp. Common Stock,$13.55,-0.27,-1.954%,553993281.00,,2017,67669,Finance,Finance: Consumer Services
CUZ,Cousins Properties Incorporated Common Stock,$35.525,-0.015,-0.042%,5372792829.00,United States,,429291,Consumer Services,Real Estate Investment Trusts
CVA,Covanta Holding Corporation Common Stock,$13.71,0.14,1.032%,1811717465.00,United States,,247051,Basic Industries,Electric Utilities: Central
CVE,Cenovus Energy Inc Common Stock,$8.0235,0.0135,0.169%,16187102955.00,Canada,,4728645,Energy,Oil & Gas Production
CVEO,Civeo Corporation (Canada) Common Shares,$15.47,-0.07,-0.45%,221099328.00,,2014,19968,Consumer Services,Hotels/Resorts
CVI,CVR Energy Inc. Common Stock,$19.24,-0.53,-2.681%,1934208725.00,United States,2007,239834,Energy,Integrated oil Companies
CVII,Churchill Capital Corp VII Class A Common Stock,$9.81,-0.05,-0.507%,1692225000.00,,2021,90853,Finance,Business Services
CVNA,Carvana Co. Class A Common Stock,$284.71,14.62,5.413%,49044413082.00,United States,2017,779118,Consumer Durables,Automotive Aftermarket
CVS,CVS Health Corporation Common Stock,$75.88,0.80,1.066%,99593938381.00,United States,,3127586,Health Care,Medical/Nursing Services
CVX,Chevron Corporation Common Stock,$103.45,-0.82,-0.786%,199457722068.00,United States,,5512017,Energy,Integrated oil Companies
CW,Curtiss-Wright Corporation Common Stock,$124.5175,0.2075,0.167%,5095120376.00,United States,,67740,Technology,Industrial Machinery/Components
CWEN,Clearway Energy Inc. Class C Common Stock,$28.73,0.24,0.842%,5795219863.00,United States,2015,275743,Public Utilities,Electric Utilities: Central
CWH,Camping World Holdings Inc. Class A Commom Stock,$41.18,0.28,0.685%,3645844986.00,United States,2016,492741,Consumer Durables,Automotive Aftermarket
CWK,Cushman & Wakefield plc Ordinary Shares,$17.01,0.19,1.13%,3789906110.00,,2018,418995,Finance,Real Estate
CWT,California Water Service Group Common Stock,$59.995,0.695,1.172%,3020629040.00,United States,,56220,Public Utilities,Water Supply
CX,Cemex S.A.B. de C.V. Sponsored ADR,$7.51,0.20,2.736%,11061457259.00,Mexico,,8179839,Capital Goods,Building Materials
CXE,MFS High Income Municipal Trust Common Stock,$5.27,0.01,0.19%,166118563.00,United States,1989,22458,,
CXH,MFS Investment Grade Municipal Trust Common Stock,$9.9603,-0.0197,-0.197%,90740773.00,United States,1989,5281,,
CXP,Columbia Property Trust Inc. Common Stock,$18.83,0.11,0.588%,2163027558.00,United States,2013,750599,Consumer Services,Real Estate Investment Trusts
CXW,CoreCivic Inc. Common Stock,$8.045,0.105,1.322%,967577733.00,United States,,857407,Consumer Services,Real Estate Investment Trusts
CYD,China Yuchai International Limited Common Stock,$15.66,-0.31,-1.941%,639840821.00,Singapore,1994,12367,Energy,Industrial Machinery/Components
CYH,Community Health Systems Inc. Common Stock,$10.14,-0.06,-0.588%,1340424142.00,United States,2000,2081355,Health Care,Hospital/Nursing Management
D,Dominion Energy Inc. Common Stock,$78.28,0.86,1.111%,63093913666.00,United States,,1991303,Public Utilities,Electric Utilities: Central
DAC,Danaos Corporation Common Stock,$51.45,-1.74,-3.271%,1057777374.00,Greece,2006,290789,Transportation,Marine Transportation
DAL,Delta Air Lines Inc. Common Stock,$46.665,-1.505,-3.124%,29779114122.00,United States,,17788660,Transportation,Air Freight/Delivery Services
DAN,Dana Incorporated Common Stock ,$26.7099,0.2199,0.83%,3874671670.00,United States,,368178,Capital Goods,Auto Parts:O.E.M.
DAO,Youdao Inc. American Depositary Shares each representing one Class A Ordinary Share,$23.25,-1.08,-4.439%,2882557227.00,,2019,173452,Consumer Services,Other Consumer Services
DAR,Darling Ingredients Inc. Common Stock,$71.62,-2.02,-2.743%,11684917807.00,United States,,763385,Consumer Non-Durables,Packaged Foods
DASH,DoorDash Inc. Class A Common Stock,$150.77,7.12,4.956%,48467088080.00,,2020,2581464,Miscellaneous,Business Services
DAVA,Endava plc American Depositary Shares (each representing one Class A Ordinary Share),$84.07,1.61,1.952%,4633715194.00,,2018,43454,Technology,EDP Services
DB,Deutsche Bank AG Common Stock,$12.33,-0.04,-0.323%,25454953705.00,Germany,,1554564,Finance,Major Banks
DBD,Diebold Nixdorf Incorporated Common Stock,$14.05,0.01,0.071%,1098406380.00,United States,,142175,Miscellaneous,Office Equipment/Supplies/Services
DBI,Designer Brands Inc. Class A Common Stock,$17.385,-0.325,-1.835%,1260649266.00,United States,,743253,Consumer Services,Clothing/Shoe/Accessory Stores
DBL,DoubleLine Opportunistic Credit Fund Common Shares of Beneficial Interest,$19.75,0.02,0.101%,295649956.00,United States,2012,31061,,
DCF,BNY Mellon Alcentra Global Credit Income 2024 Target Term Fund Inc. Common Stock,$9.26,-0.09,-0.963%,138558602.00,,2017,20456,,
DCI,Donaldson Company Inc. Common Stock,$60.14,0.58,0.974%,7585070056.00,United States,,159867,Capital Goods,Pollution Control Equipment
DCO,Ducommun Incorporated Common Stock,$61.85,-0.64,-1.024%,731875008.00,United States,,12871,Capital Goods,Military/Government/Technical
DCP,DCP Midstream  LP Common Units ,$23.47,0.33,1.426%,4890216499.00,United States,,505894,Public Utilities,Natural Gas Distribution
DCP^B,DCP Midstream LP 7.875% Series B Fixed-to-Floating Rate Cumulative Redeemable Perpetual Preferred Units,$24.124,-0.026,-0.108%,,United States,,4607,,
DCP^C,DCP Midstream LP 7.95% Series C Fixed-to-Floating Rate Cumulative Redeemable Perpetual Preferred Units,$24.3482,0.2582,1.072%,,United States,,15820,,
DCUE,Dominion Energy Inc. 2019 Series A Corporate Units,$101.77,0.77,0.762%,0.00,United States,2019,33764,Public Utilities,Electric Utilities: Central
DD,DuPont de Nemours Inc. Common Stock,$77.08,0.51,0.666%,41201207195.00,,2017,841787,Basic Industries,Major Chemicals
DDD,3D Systems Corporation Common Stock,$21.235,-1.715,-7.473%,2652184015.00,United States,,3740193,Technology,Computer Software: Prepackaged Software
DDF,Delaware Investments Dividend & Income Fund Inc. Common Stock,$10.89,0.10,0.927%,82885522.00,United States,1993,66687,,
DDS,Dillard's Inc. Common Stock,$98.29,1.51,1.56%,2151025736.00,United States,,127067,Consumer Services,Department/Specialty Retail Stores
DDT,Dillard's Capital Trust I,$25.70,-0.29,-1.116%,0.00,United States,,13753,Consumer Services,Department/Specialty Retail Stores
DE,Deere & Company Common Stock,$381.59,0.09,0.024%,119605158628.00,United States,,602389,Capital Goods,Industrial Machinery/Components
DEA,Easterly Government Properties Inc. Common Stock,$21.4072,0.0872,0.409%,1758146705.00,United States,2015,177188,Consumer Services,Real Estate Investment Trusts
DECK,Deckers Outdoor Corporation Common Stock,$339.32,3.18,0.946%,9558617254.00,United States,1993,99924,Consumer Non-Durables,Shoe Manufacturing
DEH,D8 Holdings Corp. Class A Ordinary Shares,$10.04,0.06,0.601%,432975000.00,Hong Kong,2020,8160798,Finance,Business Services
DEI,Douglas Emmett Inc. Common Stock,$32.09,-0.14,-0.434%,5630644509.00,United States,2006,362831,Consumer Services,Real Estate Investment Trusts
DELL,Dell Technologies Inc. Class C Common Stock ,$99.40,6.70,7.228%,75809138566.00,,2018,10558398,Technology,Computer Manufacturing
DEN,Denbury Inc. Common Stock,$50.31,0.33,0.66%,2515549052.00,,2020,652630,Energy,Oil & Gas Production
DEO,Diageo plc Common Stock,$178.38,4.31,2.476%,104348599864.00,United Kingdom,,270867,Consumer Non-Durables,Beverages (Production/Distribution)
DESP,Despegar.com Corp. Ordinary Shares,$12.80,-0.19,-1.463%,895308800.00,,2017,334801,Consumer Services,Transportation Services
DEX,Delaware Enhanced Global Dividend Common Shares of Beneficial Interest,$10.09,0.02,0.199%,120055855.00,United States,2007,25039,,
DFIN,Donnelley Financial Solutions Inc. Common Stock ,$28.94,-0.06,-0.207%,984806842.00,,2016,82000,Consumer Services,Other Consumer Services
DFNS,LGL Systems Acquisition Corp. Common Stock,$9.93,0.00,0.00%,214115625.00,United States,2020,29451,Finance,Business Services
DFP,Flaherty & Crumrine Dynamic Preferred and Income Fund Inc. Common Stock,$31.18,0.375,1.217%,598376222.00,,2013,80426,,
DFS,Discover Financial Services Common Stock,$102.025,0.705,0.696%,31254845564.00,United States,,1522976,Finance,Finance: Consumer Services
DG,Dollar General Corporation Common Stock,$216.12,2.57,1.203%,51709790142.00,United States,2009,1230577,Consumer Services,Department/Specialty Retail Stores
DGNR,Dragoneer Growth Opportunities Corp. Class A Ordinary Shares,$10.16,0.05,0.495%,876300000.00,United States,2020,323049,Technology,Computer Software: Prepackaged Software
DGX,Quest Diagnostics Incorporated Common Stock,$128.73,1.39,1.092%,16892541471.00,United States,,605882,Health Care,Medical Specialities
DHF,BNY Mellon High Yield Strategies Fund Common Stock,$3.14,0.02,0.641%,228302140.00,United States,1998,237258,,
DHI,D.R. Horton Inc. Common Stock,$93.28,0.45,0.485%,33926095695.00,United States,,1873773,Capital Goods,Homebuilding
DHR,Danaher Corporation Common Stock,$242.29,4.99,2.103%,172769120456.00,United States,,1562691,Capital Goods,Industrial Machinery/Components
DHR^A,Danaher Corporation 4.75% Mandatory Convertible Preferred Stock Series A,$1614.11,0.00,0.00%,,United States,,8986,,
DHR^B,Danaher Corporation 5.00% Mandatory Convertible Preferred Stock Series B,$1370.00,17.06,1.261%,,United States,,1303,,
DHT,DHT Holdings Inc.,$5.68,-0.10,-1.73%,974114343.00,Jersey,2005,1902838,Transportation,Marine Transportation
DHX,DHI Group Inc. Common Stock,$3.24,0.06,1.887%,169572988.00,United States,2007,74357,Miscellaneous,Business Services
DIAX,Nuveen Dow 30SM Dynamic Overwrite Fund Common Shares of Beneficial Interest,$16.69,0.08,0.482%,606963795.00,,2014,37603,,
DIN,Dine Brands Global Inc. Common Stock,$92.10,0.44,0.48%,1571022091.00,United States,,222279,Consumer Services,Restaurants
DIS,Walt Disney Company (The) Common Stock,$186.08,-1.38,-0.736%,337784306326.00,United States,,5005125,Consumer Services,Services-Misc. Amusement & Recreation
DK,Delek US Holdings Inc. Common Stock,$22.01,-0.32,-1.433%,1625993086.00,United States,2017,246420,Energy,Integrated oil Companies
DKL,Delek Logistics Partners L.P. Common Units representing Limited Partner Interests,$38.26,0.72,1.918%,1662142035.00,United States,2012,15327,Energy,Natural Gas Distribution
DKS,Dick's Sporting Goods Inc Common Stock,$81.96,0.33,0.404%,7317496659.00,United States,2002,538128,Consumer Services,Other Specialty Stores
DLB,Dolby Laboratories Common Stock,$101.58,1.10,1.095%,10321844782.00,United States,2005,299550,Miscellaneous,Multi-Sector Companies
DLNG,Dynagas LNG Partners LP Common Units,$2.7158,-0.0342,-1.244%,96716645.00,Greece,,26765,Consumer Services,Marine Transportation
DLNG^A,Dynagas LNG Partners LP 9.00% Series A Cumulative Redeemable Preferred Units,$25.60,-0.17,-0.66%,,Greece,,2305,,
DLNG^B,Dynagas LNG Partners LP 8.75% Series B Fixed to Floating Rate Cumulative Redeemable Perpetual Preferred Units liquidation preference $25.00 per Uni,$23.25,0.10,0.432%,,Greece,,10564,,
DLR,Digital Realty Trust Inc. Common Stock,$146.83,3.21,2.235%,41277005533.00,United States,2004,421485,Consumer Services,Real Estate Investment Trusts
DLR^C,Digital Realty Trust Inc. 6.625% Series C Cumulative Redeemable Perpetual Preferred Stock,$25.26,0.01,0.04%,,United States,,7194,,
DLR^J,Digital Realty Trust Inc. 5.250% Series J Cumulative Redeemable Preferred Stock,$26.78,-0.01,-0.037%,,United States,,14810,,
DLR^K,Digital Realty Trust Inc. 5.850% Series K Cumulative Redeemable Preferred Stock par value $0.01 per share,$28.26,0.03,0.106%,,United States,,5110,,
DLR^L,Digital Realty Trust Inc. 5.200% Series L Cumulative Redeemable Preferred Stock,$27.6201,0.0001,0.00%,,United States,,74019,,
DLX,Deluxe Corporation Common Stock,$41.94,-0.64,-1.503%,1765685534.00,United States,,44817,Consumer Durables,Publishing
DLY,DoubleLine Yield Opportunities Fund Common Shares of Beneficial Interest,$19.56,0.00,0.00%,0.00,,2020,74615,,
DM,Desktop Metal Inc. Class A Common Stock,$12.5899,-0.5801,-4.405%,3077585292.00,,2019,2236785,Technology,Industrial Machinery/Components
DMB,BNY Mellon Municipal Bond Infrastructure Fund Inc. Common Stock,$14.71,-0.05,-0.339%,270481199.00,,2013,18852,,
DMO,Western Asset Mortgage Opportunity Fund Inc. Common Stock,$14.9141,0.0841,0.567%,164459481.00,United States,2010,24060,,
DMS,Digital Media Solutions Inc. Class A Ordinary Shares,$11.83,-0.15,-1.252%,706086125.00,United States,2018,28427,Miscellaneous,Business Services
DMYD,dMY Technology Group Inc. II Class A Common Stock,$19.455,0.005,0.026%,671197500.00,United States,2020,306345,Finance,Business Services
DMYI,dMY Technology Group Inc. III Class A Common Stock,$10.49,-0.10,-0.944%,393375000.00,United States,2021,257606,Technology,EDP Services
DNB,Dun & Bradstreet Holdings Inc. Common Stock,$22.91,0.44,1.958%,9838451935.00,United States,2020,763015,Finance,Finance: Consumer Services
DNMR,Danimer Scientific Inc. Common Stock,$31.82,-0.99,-3.017%,2810588019.00,,2020,1234464,Basic Industries,Major Chemicals
DNOW,NOW Inc. Common Stock,$9.63,-0.20,-2.035%,1068842579.00,,2014,234130,Energy,Metal Fabrications
DNP,DNP Select Income Fund Inc. Common Stock,$10.167,0.007,0.069%,3144679016.00,United States,1987,528652,,
DNZ,D and Z Media Acquisition Corp. Class A Common Stock,$9.975,0.075,0.758%,358476563.00,,2021,753260,Finance,Business Services
DOC,Physicians Realty Trust Common Shares of Beneficial Interest,$18.41,0.24,1.321%,3881293184.00,United States,2013,1027563,Consumer Services,Real Estate Investment Trusts
DOCN,DigitalOcean Holdings Inc. Common Stock,$45.15,1.68,3.865%,4754445801.00,,2021,477418,Technology,Computer Software: Programming Data Processing
DOOR,Masonite International Corporation Ordinary Shares (Canada),$125.22,1.32,1.065%,3072938370.00,Canada,,30120,Basic Industries,Forest Products
DOV,Dover Corporation Common Stock,$138.735,0.435,0.315%,19957952754.00,United States,,337730,Technology,Industrial Machinery/Components
DOW,Dow Inc. Common Stock ,$64.59,0.35,0.545%,48134073578.00,,2019,1812436,Basic Industries,Major Chemicals
DPG,Duff & Phelps Utility and Infrastructure Fund Inc.,$13.68,-0.17,-1.227%,518879746.00,United States,2011,177177,,
DPZ,Domino's Pizza Inc Common Stock,$393.19,2.55,0.653%,15255943431.00,United States,2004,235844,Consumer Non-Durables,Food Distributors
DQ,DAQO New Energy Corp. American Depositary Shares each representing five ordinary shares,$67.56,1.26,1.90%,4694327555.00,China,2010,1946092,Technology,Semiconductors
DRD,DRDGOLD Limited American Depositary Shares,$10.08,0.48,5.00%,861954700.00,South Africa,,173595,Basic Industries,Precious Metals
DRE,Duke Realty Corporation Common Stock,$44.195,0.835,1.926%,16518603043.00,United States,,645453,Consumer Services,Real Estate Investment Trusts
DRH,Diamondrock Hospitality Company Common Stock,$9.99,-0.11,-1.089%,2114679644.00,United States,2005,1037731,Consumer Services,Real Estate Investment Trusts
DRH^A,Diamondrock Hospitality Company 8.250% Series A Cumulative Redeemable Preferred Stock,$28.42,0.02,0.07%,,United States,,126,,
DRI,Darden Restaurants Inc. Common Stock,$144.425,0.275,0.191%,18896953192.00,United States,,505630,Consumer Services,Restaurants
DRQ,Dril-Quip Inc. Common Stock,$30.585,-0.365,-1.179%,1083589175.00,United States,1997,51655,Energy,Metal Fabrications
DRUA,Dominion Energy Inc. 2016 Series A 5.25% Enhanced Junior Subordinated Notes due 2076,$25.70,0.09,0.351%,0.00,United States,2016,21150,Public Utilities,Electric Utilities: Central
DS,Drive Shack Inc.,$3.1919,-0.0581,-1.788%,291392557.00,United States,,1316482,Consumer Services,Restaurants
DS^B,Drive Shack Inc. Preferred Series B,$24.95,0.0366,0.147%,,United States,,3663,,
DS^C,Drive Shack Inc. Preferred Series C,$22.91,0.00,0.00%,,United States,,241,,
DS^D,Drive Shack Inc. Pfd Ser D,$23.41,0.29,1.254%,,United States,,100,,
DSE,Duff & Phelps Select MLP and Midstream Energy Fund Inc.,$7.54,-0.01,-0.132%,19780097.00,United States,2014,7151,,
DSL,DoubleLine Income Solutions Fund Common Shares of Beneficial Interests,$18.08,0.02,0.111%,1843380897.00,,2013,151721,,
DSM,BNY Mellon Strategic Municipal Bond Fund Inc. Common Stock,$8.00,-0.04,-0.498%,395372088.00,United States,1989,51530,,
DSSI,Diamond S Shipping Inc. Common Stock ,$9.90,0.06,0.61%,400487472.00,,2019,146070,Consumer Services,Transportation Services
DSU,Blackrock Debt Strategies Fund Inc. Common Stock,$11.11,0.00,0.00%,517634976.00,United States,1998,112832,,
DSX,Diana Shipping inc. common stock,$3.06,-0.02,-0.649%,280097106.00,Greece,2005,408606,Transportation,Marine Transportation
DSX^B,Diana Shipping Inc. Perpetual Preferred Shares Series B (Marshall Islands),$25.49,-0.2301,-0.895%,,Greece,,5984,,
DT,Dynatrace Inc. Common Stock,$54.40,0.26,0.48%,15373102883.00,United States,2019,594662,Technology,Computer Software: Prepackaged Software
DTB,DTE Energy Company 2020 Series G 4.375% Junior Subordinated Debentures due 2080,$25.49,0.25,0.99%,0.00,United States,2020,12414,Public Utilities,Electric Utilities: Central
DTE,DTE Energy Company Common Stock,$139.2277,0.5077,0.366%,26972194015.00,United States,,389992,Public Utilities,Electric Utilities: Central
DTF,DTF Tax-Free Income Inc. Common Stock,$14.72,-0.02,-0.136%,103475212.00,United States,1991,482,,
DTJ,DTE Energy Company 2016 Series B 5.375% Junior Subordinated Debentures due 2076,$25.7568,0.1068,0.416%,0.00,United States,2016,8347,Public Utilities,Electric Utilities: Central
DTLA^,Brookfield DTLA Inc. 7.625% Series A Cumulative Redeemable Preferred Stock,$14.8699,-0.0301,-0.202%,,,,5217,,
DTP,DTE Energy Company 6.25% Corporate Units,$50.70,0.01,0.02%,0.00,United States,,13182,Public Utilities,Electric Utilities: Central
DTW,DTE Energy Company 2017 Series E 5.25% Junior Subordinated Debentures due 2077,$26.25,0.02,0.076%,0.00,United States,2017,24962,Public Utilities,Electric Utilities: Central
DTY,DTE Energy Company 2016 Series F 6.00% Junior Subordinated Debentures due 2076,$26.1401,-0.0099,-0.038%,0.00,United States,2016,8682,Public Utilities,Electric Utilities: Central
DUK,Duke Energy Corporation (Holding Company) Common Stock,$99.64,0.85,0.86%,76644733854.00,United States,,1473221,Public Utilities,Power Generation
DUK^A,Duke Energy Corporation Depositary Shares each representing a 1/1000th interest in a share of 5.75% Series A Cumulative Redeemable Perpetual Preferred Stock,$27.905,0.045,0.162%,,United States,,41515,Public Utilities,Power Generation
DUKB,Duke Energy Corporation 5.625% Junior Subordinated Debentures due 2078,$27.02,0.07,0.26%,0.00,United States,2018,29434,Public Utilities,Power Generation
DUKH,Duke Energy Corporation 5.125% Junior Subordinated Debentures due 2073,$26.01,-0.06,-0.23%,0.00,United States,,28907,Public Utilities,Power Generation
DVA,DaVita Inc. Common Stock,$110.05,1.82,1.682%,11981143500.00,United States,,449888,Health Care,Misc Health and Biotechnology Services
DVD,Dover Motorsports Inc. Common Stock,$2.10,0.03,1.449%,76535741.00,United States,1996,29828,Consumer Services,Services-Misc. Amusement & Recreation
DVN,Devon Energy Corporation Common Stock,$22.445,-0.045,-0.20%,15107729500.00,United States,,4850916,Energy,Oil & Gas Production
DWIN,Delwinds Insurance Acquisition Corp. Class A Common Stock,$9.84,0.00,0.00%,253761300.00,,2021,68,Finance,Business Services
DX,Dynex Capital Inc. Common Stock,$19.555,-0.085,-0.433%,593583597.00,United States,,356498,Consumer Services,Real Estate Investment Trusts
DX^C,Dynex Capital Inc. 6.900% Series C Fixed-to-Floating Rate Cumulative Redeemable Preferred Stock,$25.2682,0.0682,0.271%,,United States,,9585,,
DXC,DXC Technology Company Common Stock ,$31.85,0.07,0.22%,8108818677.00,,,916105,Technology,EDP Services
DY,Dycom Industries Inc. Common Stock,$92.73,-0.61,-0.654%,2839013149.00,United States,,134449,Basic Industries,Water Supply
DYFN,Angel Oak Dynamic Financial Strategies Income Term Trust Common Shares of Beneficial Interest,$19.5009,-0.0591,-0.302%,79076150.00,,2020,15320,,
E,ENI S.p.A. Common Stock,$24.86,-0.07,-0.281%,44406792150.00,Italy,,246515,Energy,Oil & Gas Production
EAF,GrafTech International Ltd. Common Stock,$11.905,-0.045,-0.377%,3181434925.00,United States,2018,846325,Energy,Industrial Machinery/Components
EAI,Entergy Arkansas LLC First Mortgage Bonds 4.875% Series Due September 1 2066,$25.66,0.10,0.391%,0.00,United States,2016,6488,Public Utilities,Electric Utilities: Central
EARN,Ellington Residential Mortgage REIT Common Shares of Beneficial Interest,$12.19,0.00,0.00%,150467777.00,United States,2013,44524,Consumer Services,Real Estate Investment Trusts
EAT,Brinker International Inc. Common Stock,$67.415,-0.505,-0.744%,3064692439.00,United States,,315504,Consumer Services,Restaurants
EB,Eventbrite Inc. Class A Common Stock,$22.50,-0.12,-0.531%,2091660368.00,United States,2018,621136,Technology,Computer Software: Programming Data Processing
EBF,Ennis Inc. Common Stock,$20.60,-0.23,-1.104%,537032586.00,United States,,42519,Consumer Services,Office Equipment/Supplies/Services
EBR,Centrais Electricas Brasileiras S A American Depositary Shares (Each representing one Common Share),$6.145,0.025,0.408%,9641080442.00,,2016,691049,Public Utilities,Electric Utilities: Central
EBS,Emergent Biosolutions Inc. Common Stock,$75.05,0.58,0.779%,4020948221.00,United States,2006,378482,Health Care,Major Pharmaceuticals
EC,Ecopetrol S.A. American Depositary Shares,$12.805,0.045,0.353%,26324963769.00,Colombia,,334658,Energy,Oil & Gas Production
ECC           ,Eagle Point Credit Company Inc. Common Stock,$12.30,0.00,0.00%,397965147.00,United States,2014,109001,,
ECCB,Eagle Point Credit Company Inc. 7.75% Series B Term Preferred Stock due 2026,$25.765,0.105,0.409%,0.00,United States,2016,7076,,
ECCW,Eagle Point Credit Company Inc. 6.75% Notes due 2031,$25.41,0.06,0.237%,0.00,United States,2021,7952,,
ECCX,Eagle Point Credit Company Inc. 6.6875% Notes due 2028,$25.40,0.05,0.197%,0.00,United States,2018,5052,,
ECCY,Eagle Point Credit Company Inc. 6.75% Notes due 2027,$25.61,0.00,0.00%,0.00,United States,2017,8,,
ECL,Ecolab Inc. Common Stock,$219.97,1.58,0.723%,62928602737.00,United States,,380688,Basic Industries,Package Goods/Cosmetics
ECOM          ,ChannelAdvisor Corporation Common Stock,$25.44,0.19,0.752%,755964915.00,United States,2013,94198,Technology,Computer Software: Prepackaged Software
ED,Consolidated Edison Inc. Common Stock,$77.01,0.85,1.116%,26390428601.00,United States,,842112,Public Utilities,Power Generation
EDD,Morgan Stanley Emerging Markets Domestic Debt Fund Inc. Morgan Stanley Emerging Markets Domestic Debt Fund Inc. Common Stock,$6.12,0.12,2.00%,404483805.00,United States,2007,193270,,
EDF,Stone Harbor Emerging Markets Income Fund Common Shares of Beneficial Interest,$8.8699,0.0399,0.452%,147913299.00,United States,2010,101419,,
EDI,Stone Harbor Emerging Markets Total Income Fund Common Shares of Beneficial Interests,$9.2199,0.0799,0.874%,91075629.00,United States,2012,43407,,
EDN,Empresa Distribuidora Y Comercializadora Norte S.A. (Edenor) Empresa Distribuidora Y Comercializadora Norte S.A. (Edenor) American Depositary Shares,$3.49,-0.11,-3.056%,152700451.00,Argentina,2007,11161,Public Utilities,Electric Utilities: Central
EDU,New Oriental Education & Technology Group Inc. Sponsored ADR representing 1 Ordinary Share (Cayman Islands),$14.765,0.085,0.579%,25124993216.00,China,2006,9051979,Consumer Services,Other Consumer Services
EEA,The European Equity Fund Inc. Common Stock,$11.14,0.02,0.18%,80327109.00,United States,,5207,,
EEX,Emerald Holding Inc. Common Stock,$5.15,-0.21,-3.918%,372208906.00,United States,2017,65688,Miscellaneous,Business Services
EFC,Ellington Financial Inc. Common Stock ,$17.985,0.335,1.898%,787413587.00,United States,2010,268822,Finance,Real Estate
EFC^A,Ellington Financial Inc. 6.750% Series A Fixed-to-Floating Rate Cumulative Redeemable Preferred Stock,$26.04,-0.2699,-1.026%,,United States,,17372,,
EFF,Eaton vance Floating-Rate Income Plus Fund Common Shares of Beneficial Interest,$16.505,0.025,0.152%,125543995.00,,2013,9269,,
