Symbol,Name,Last Sale,Net Change,% Change,Market Cap,Country,IPO Year,Volume,Sector,Industry
PRI,Primerica Inc. Common Stock,$156.72,0.65,0.416%,6176975401.00,United States,2010,36182,Finance,Life Insurance
PRIF^A,Priority Income Fund Inc. 6.375% Series A Term Preferred Stock due 2025,$24.78,-0.0523,-0.211%,,,,9955,,
PRIF^B,Priority Income Fund Inc. 6.25% Series B Term Preferred Stock due 2023  par value $0.01 per share,$25.11,0.03,0.12%,,,,104383,,
PRIF^C,Priority Income Fund Inc. 6.625% Series C Term Preferred Stock due 2024 par value $0.01 per share,$25.2412,0.00,0.00%,,,,39,,
PRIF^D,Priority Income Fund Inc. 7.00% Series D Term Preferred Stock due 2029,$25.25,0.00,0.00%,,,,39,,
PRIF^E,Priority Income Fund Inc. 6.375% Series E Preferred Stock Due 2024,$25.07,-0.06,-0.239%,,,,2994,,
PRIF^F,Priority Income Fund Inc. 6.625% Series F Term Preferred Stock due 2027,$25.07,-0.11,-0.437%,,,,1466,,
PRIF^G,Priority Income Fund Inc. 6.25% Series G Preferred Stock Due 2026,$25.09,0.065,0.26%,,,,9080,,
PRLB,Proto Labs Inc. Common stock,$108.09,-0.74,-0.68%,2992984645.00,United States,2012,225256,Capital Goods,Metal Fabrications
PRMW,Primo Water Corporation Common Stock,$16.485,0.095,0.58%,2650984716.00,Canada,,139879,Consumer Non-Durables,Beverages (Production/Distribution)
PRO,PROS Holdings Inc. Common Stock,$45.98,0.82,1.816%,2033944933.00,United States,2007,134164,Technology,EDP Services
PROS,ProSight Global Inc. Common Stock,$12.65,0.00,0.00%,553167043.00,United States,2019,3211,Finance,Property-Casualty Insurers
PRPB,CC Neuberger Principal Holdings II Class A Ordinary Shares,$10.03,0.03,0.30%,1088255000.00,United States,2020,187827,Finance,Business Services
PRPC,CC Neuberger Principal Holdings III Class A Ordinary Shares,$10.02,0.10,1.008%,0.00,,2021,10508,Finance,Business Services
PRS,Prudential Financial Inc. 5.625% Junior Subordinated Notes due 2058,$27.89,0.05,0.18%,949977104.00,United States,2018,18403,Finance,Life Insurance
PRSP,Perspecta Inc. Common Stock ,$29.19,0.01,0.034%,4706203607.00,,2018,534750,Technology,EDP Services
PRT,PermRock Royalty Trust Trust Units,$5.3501,-0.0999,-1.833%,65087883.00,United States,2018,31044,Energy,Oil & Gas Production
PRTY,Party City Holdco Inc. Common Stock,$6.12,0.12,2.00%,677687000.00,United States,2015,883865,Consumer Services,Other Specialty Stores
PRU,Prudential Financial Inc. Common Stock,$97.33,-0.01,-0.01%,38485844633.00,United States,2001,1683178,Finance,Life Insurance
PSA,Public Storage Common Stock,$266.73,3.04,1.153%,46621665750.00,United States,,267217,Consumer Services,Real Estate Investment Trusts
PSA^C,Public Storage Depositary Shares Each Representing 1/1000 of a 5.125% Cumulative Preferred Share of Beneficial Interest Series C,$25.8097,0.0397,0.154%,,United States,,6960,Consumer Services,Real Estate Investment Trusts
PSA^D,Public Storage Depositary Shares Each Representing 1/1000 of a 4.95% Cumulative Preferred Share of Beneficial Interest Series D,$25.55,-0.10,-0.39%,,United States,,1259,Consumer Services,Real Estate Investment Trusts
PSA^E,Public Storage Depositary Shares Each Representing 1/1000 of a 4.90% Cumulative Preferred Share of Beneficial Interest Series E,$25.90,0.04,0.155%,,United States,,11563,Consumer Services,Real Estate Investment Trusts
PSA^F,Public Storage Depositary Shares Each Representing 1/1000 of a 5.15% Cumulative Preferred Share of Beneficial Interest Series F par value $0.01 per share,$26.82,0.06,0.224%,,United States,,8595,Consumer Services,Real Estate Investment Trusts
PSA^G,Public Storage Depositary Shares Each Representing 1/1000 of a 5.05% Cumulative Preferred Share of Beneficial Interest Series G,$26.62,0.18,0.681%,,United States,,13816,,
PSA^H,Public Storage Depositary Shares Each Representing 1/1000 of a  5.60% Cumulative Preferred  Share of Beneficial Interest Series H,$28.48,0.02,0.07%,,United States,,16148,,
PSA^I,Public Storage Depositary Shares Each Representing 1/1000 of a 4.875% Cumulative Preferred Share of Beneficial Interest Series I par value $0.01 per share,$27.68,0.06,0.217%,,United States,,3729,,
PSA^J,Public Storage Depositary Shares Each Representing 1/1000 of a 4.700% Cumulative Preferred Share of Beneficial Interest Series J par value $0.01 per share,$27.81,0.06,0.216%,,United States,,13482,,
PSA^K,Public Storage Depositary Shares Each Representing 1/1000 of a 4.75% Cumulative Preferred Share of Beneficial Interest Series K,$27.86,0.00,0.00%,,United States,,4236,Consumer Services,Real Estate Investment Trusts
PSA^L,Public Storage Depositary Shares Each Representing 1/1000 of a 4.625% Cumulative Preferred Share of Beneficial Interest Series L par value $0.01 per share,$27.40,0.04,0.146%,,United States,,46559,Consumer Services,Real Estate Investment Trusts
PSA^M,Public Storage Depositary Shares Each Representing 1/1000 of a 4.125% Cumulative Preferred Share of Beneficial Interest Series M,$26.46,-0.12,-0.451%,,United States,,39716,,
PSA^N,Public Storage Depositary Shares Each Representing 1/1000 of a 3.875% Cumulative Preferred Share of Beneficial Interest Series N,$25.60,0.10,0.392%,,United States,,30295,,
PSA^O,Public Storage Depositary Shares Each Representing 1/1000 of a 3.900% Cumulative Preferred Share of Beneficial Interest Series O,$26.1657,0.0357,0.137%,,United States,,36671,,
PSB,PS Business Parks Inc. Common Stock,$161.29,1.27,0.794%,4433649842.00,United States,,24605,Consumer Services,Real Estate Investment Trusts
PSB^W,PS Business Parks Inc. Depositary Shares Each Representing 1/1000 of a Share of 5.20% Cumulative Preferred Stock Series W,$25.935,0.005,0.019%,,United States,,5695,,
PSB^X,PS Business Parks Inc. Depositary Shares Each Representing 1/1000 of a Share of 5.25% Cumulative Preferred Stock Series X,$26.8182,0.0582,0.217%,,United States,,9203,,
PSB^Y,PS Business Parks Inc. 5.20% Cumulative Preferred Stock Series Y,$26.75,0.00,0.00%,,United States,,6581,,
PSB^Z,PS Business Parks Inc. Depositary Shares Each Representing 1/1000 of a Share of 4.875% Cumulative Preferred Stock Series Z  par value $0.01 per share,$27.00,0.06,0.223%,,United States,,26923,,
PSF,Cohen & Steers Select Preferred and Income Fund Inc. Common Stock,$28.60,-0.17,-0.591%,343674417.00,,2010,7656,,
PSFE,Paysafe Limited Common Shares,$13.972,0.242,1.763%,10111709401.00,,2021,4030168,Finance,Business Services
PSN,Parsons Corporation Common Stock,$41.73,0.75,1.83%,4271510425.00,,2019,251686,Technology,EDP Services
PSO,Pearson Plc Common Stock,$11.27,0.20,1.807%,8494576342.00,United Kingdom,,112708,Consumer Services,Books
PSTG,Pure Storage Inc. Class A Common Stock,$21.67,-0.02,-0.092%,6074876656.00,,2015,1605871,Technology,Electronic Components
PSTH,Pershing Square Tontine Holdings Ltd. Class A Common Stock,$24.305,-0.365,-1.48%,4861002431.00,,2020,1158358,Finance,Business Services
PSTL,Postal Realty Trust Inc. Class A Common Stock,$18.38,0.02,0.109%,244941327.00,,2019,87800,Consumer Services,Real Estate Investment Trusts
PSX,Phillips 66 Common Stock,$78.84,-0.55,-0.693%,34521315074.00,United States,,1216377,Energy,Integrated oil Companies
PSXP,Phillips 66 Partners LP Common Units representing limited partner interest in the Partnership,$33.12,0.49,1.502%,7562625636.00,United States,2013,417607,Energy,Natural Gas Distribution
PTA,Cohen & Steers Tax-Advantaged Preferred Securities and Income Fund Common Shares of Beneficial Interest,$25.11,-0.03,-0.119%,1387916505.00,,2020,55302,,
PTR,PetroChina Company Limited Common Stock,$36.49,0.33,0.913%,66784354799.00,China,,161059,Energy,Oil & Gas Production
PTY,Pimco Corporate & Income Opportunity Fund,$18.72,0.03,0.161%,2070744830.00,United States,2002,241833,,
PUK,Prudential Public Limited Company Common Stock,$43.38,0.37,0.86%,56732439568.00,United Kingdom,,96673,Finance,Life Insurance
PUK^,Prudential Public Limited Company 6.75% Perpetual Subordinated Captial Security,$27.915,-0.045,-0.161%,,United Kingdom,,4804,,
PUK^A,Prudential Public Limited Company 6.50% Perpetual Subordinated Capital Securities Exchangeable at the Issuer's Option Into Non-Cumulative Dollar Denominated Preference Shares,$27.701,0.031,0.112%,,United Kingdom,,6564,,
PUMP,ProPetro Holding Corp. Common Stock,$10.63,-0.25,-2.298%,1084874573.00,United States,2017,215440,Energy,Oilfield Services/Equipment
PV,Primavera Capital Acquisition Corporation Class A Ordinary Shares,$10.00,-0.07,-0.695%,537500000.00,,2021,569337,Finance,Business Services
PVG,Pretium Resources Inc. Ordinary Shares (Canada),$11.495,0.465,4.216%,2158566551.00,Canada,,845286,Basic Industries,Precious Metals
PVH,PVH Corp. Common Stock,$107.495,-0.245,-0.227%,7650460106.00,United States,,434847,Consumer Non-Durables,Apparel
PVL,Permianville Royalty Trust Trust Units ,$1.44,-0.06,-4.00%,47520000.00,United States,2011,74115,Energy,Oil & Gas Production
PWR,Quanta Services Inc. Common Stock,$94.89,0.88,0.936%,13129455514.00,United States,,587750,Capital Goods,Engineering & Construction
PXD,Pioneer Natural Resources Company Common Stock,$152.38,-0.72,-0.47%,33023856990.00,United States,,1328227,Energy,Oil & Gas Production
PYN,PIMCO New York Municipal Income Fund III Common Shares of Beneficial Interest,$10.08,0.10,1.002%,57738240.00,United States,2002,1018,,
PYS,Merrill Lynch Depositor Inc PPlus Tr Ser RRD-1 Tr Ctf Cl A,$20.90,0.05,0.24%,0.00,United States,,5342,Finance,Finance: Consumer Services
PYT,PPlus Tr GSC-2 Tr Ctf Fltg Rate,$23.84,0.145,0.612%,0.00,United States,,2904,Finance,Finance: Consumer Services
PZC,PIMCO California Municipal Income Fund III Common Shares of Beneficial Interest,$10.71,0.00,0.00%,239700510.00,United States,2002,6185,,
PZN,Pzena Investment Management Inc Class A Common Stock,$10.96,0.33,3.104%,795585973.00,United States,2007,33877,Finance,Investment Managers
QD,Qudian Inc. American Depositary Shares each representing one Class A Ordinary Share,$1.81,-0.21,-10.396%,459250122.00,China,2017,5442466,Finance,Finance: Consumer Services
QFTA,Quantum FinTech Acquisition Corporation Common Stock,$9.83,-0.04,-0.405%,247285938.00,,2021,8282,Finance,Business Services
QGEN,Qiagen N.V. Common Shares ,$52.625,1.445,2.823%,11991726952.00,Netherlands,,559853,Health Care,Biotechnology: Biological Products (No Diagnostic Substances)
QS,QuantumScape Corporation Class A Common Stock,$35.85,-5.00,-12.24%,13629453609.00,United States,2020,51607559,Miscellaneous,Industrial Machinery/Components
QSR,Restaurant Brands International Inc. Common Shares,$65.59,-0.09,-0.137%,19881198658.00,Canada,2014,691635,Consumer Services,Restaurants
QTS,QTS Realty Trust Inc. Class A Common Stock,$65.23,1.39,2.177%,4239069591.00,United States,2013,104188,Consumer Services,Real Estate Investment Trusts
QTS^A,QTS Realty Trust Inc. 7.125% Series A Cumulative Redeemable Perpetual Preferred Stock,$27.755,0.415,1.518%,,United States,,60118,,
QTS^B,QTS Realty Trust Inc. 6.50% Series B Cumulative Convertible Perpetual Preferred Stock,$144.00,0.00,0.00%,,United States,,127,,
QTWO,Q2 Holdings Inc. Common Stock,$105.10,0.41,0.392%,5843508711.00,,2014,336504,Technology,Computer Software: Prepackaged Software
QUAD,Quad Graphics Inc Class A Common Stock,$3.805,-0.055,-1.425%,205495490.00,United States,,216314,Miscellaneous,Publishing
QUOT,Quotient Technology Inc. Common Stock,$16.87,-0.54,-3.102%,1561803141.00,,2014,530821,Consumer Services,Advertising
QVCC,QVC Inc. 6.250% Senior Secured Notes due 2068,$25.60,0.07,0.274%,0.00,United States,2019,21592,Consumer Services,Catalog/Specialty Distribution
QVCD,QVC Inc. 6.375% Senior Secured Notes due 2067,$25.59,0.04,0.157%,0.00,United States,2018,4750,Consumer Services,Catalog/Specialty Distribution
R,Ryder System Inc. Common Stock,$78.35,1.35,1.753%,4217356184.00,United States,,120547,Consumer Services,Rental/Leasing Companies
RA,Brookfield Real Assets Income Fund Inc. Common Stock,$21.78,0.02,0.092%,955931017.00,,2016,210785,,
RAAS,Cloopen Group Holding Limited American Depositary Shares each representing two Class A Ordinary Shares,$11.21,-0.34,-2.944%,1791865824.00,,2021,649266,Technology,Computer Software: Prepackaged Software
RACE,Ferrari N.V. Common Shares,$209.56,2.14,1.032%,52021819426.00,,2015,727840,Capital Goods,Auto Manufacturing
RAD,Rite Aid Corporation Common Stock,$17.68,-1.37,-7.192%,976366738.00,United States,,5063496,Health Care,Medical/Nursing Services
RAMP,LiveRamp Holdings Inc. Common Stock,$51.05,1.05,2.10%,3416235932.00,United States,2018,358098,Technology,EDP Services
RBA,Ritchie Bros. Auctioneers Incorporated Common Stock,$63.05,1.11,1.792%,6933487318.00,Canada,,354773,Miscellaneous,Business Services
RBAC,RedBall Acquisition Corp. Class A Ordinary Shares,$10.10,0.05,0.498%,725937500.00,United States,2020,204361,Finance,Business Services
RBC,Regal Beloit Corporation Common Stock,$144.25,0.65,0.453%,5859936557.00,United States,,75440,Consumer Durables,Metal Fabrications
RBLX,Roblox Corporation Class A Common Stock,$79.91,4.56,6.052%,43993687200.00,,2021,7664275,Technology,Computer Software: Prepackaged Software
RC,Ready Capital Corproation Common Stock,$14.08,0.14,1.004%,1002455027.00,United States,2013,235985,Consumer Services,Real Estate Investment Trusts
RC^B,Ready Capital Corporation 8.625% Series B Cumulative Preferred Stock,$25.35,-0.0139,-0.055%,,United States,,3327,,
RC^C,Ready Capital Corporation 6.25% Series C Cumulative Convertible Preferred Stock,$25.0541,0.0041,0.016%,,United States,,5729,,
RC^D,Ready Capital Corporation 7.625% Series D Cumulative Redeemable Preferred Stock,$25.07,-0.01,-0.04%,,United States,,3508,,
RCA,Ready Capital Corporation 7.00% Convertible Senior Notes due 2023,$26.44,-0.14,-0.527%,0.00,United States,2017,1810,Consumer Services,Real Estate Investment Trusts
RCB,Ready Capital Corporation 6.20% Senior Notes due 2026,$26.02,-0.02,-0.077%,0.00,United States,2019,1775,Consumer Services,Real Estate Investment Trusts
RCC,Ready Capital Corporation 5.75% Senior Notes due 2026,$25.70,-0.05,-0.194%,,United States,2021,890,Consumer Services,Real Estate Investment Trusts
RCI,Rogers Communication Inc. Common Stock,$48.04,-0.37,-0.764%,23953198170.00,Canada,,192853,Consumer Services,Television Services
RCL,D/B/A Royal Caribbean Cruises Ltd. Common Stock,$84.93,-1.60,-1.849%,21619705892.00,United States,1993,2258430,Consumer Services,Marine Transportation
RCS,PIMCO Strategic Income Fund Inc.,$7.4379,-0.0021,-0.028%,328651049.00,United States,1994,78307,,
RCUS,Arcus Biosciences Inc. Common Stock,$35.18,1.97,5.932%,2493425490.00,,2018,292462,Health Care,Major Pharmaceuticals
RDN,Radian Group Inc. Common Stock,$23.72,0.13,0.551%,4537627010.00,United States,,270647,Finance,Property-Casualty Insurers
RDS/B,Royal Dutch Shell PLC,$37.595,-0.015,-0.04%,,Netherlands,,1632180,,
RDY,Dr. Reddy's Laboratories Ltd Common Stock,$64.22,1.14,1.807%,10656649268.00,India,,118191,Health Care,Major Pharmaceuticals
RE,Everest Re Group Ltd. Common Stock,$261.92,2.47,0.952%,10518525951.00,Bermuda,,80677,Finance,Property-Casualty Insurers
RELX,RELX PLC PLC American Depositary Shares (Each representing One Ordinary Share),$26.7899,0.1399,0.525%,51775328137.00,United Kingdom,2015,321821,Miscellaneous,Business Services
RENN,Renren Inc. American Depositary Shares each representing fifteen Class A ordinary shares,$8.38,-0.17,-1.988%,197599076.00,China,2011,47976,Consumer Durables,Automotive Aftermarket
RES,RPC Inc. Common Stock,$5.20,-0.34,-6.137%,1122217013.00,United States,,651242,Energy,Oilfield Services/Equipment
REV,Revlon Inc. New Common Stock,$11.38,-0.02,-0.175%,606990059.00,United States,1996,61720,Consumer Non-Durables,Package Goods/Cosmetics
REVG,REV Group Inc. Common Stock,$18.735,-0.115,-0.61%,1212869540.00,United States,2017,680131,Capital Goods,Auto Manufacturing
REX,REX American Resources Corporation,$84.945,-0.775,-0.904%,508990440.00,United States,,5367,Basic Industries,Major Chemicals
REXR,Rexford Industrial Realty Inc. Common Stock,$54.24,1.21,2.282%,7128758590.00,United States,2013,249299,Consumer Services,Real Estate Investment Trusts
REXR^A,Rexford Industrial Realty Inc. 5.875% Series A Cumulative Redeemable Preferred Stock,$25.3909,-0.028,-0.11%,,United States,,34743,,
REXR^B,Rexford Industrial Realty Inc. 5.875% Series B Cumulative Redeemable Preferred Stock,$26.20,0.0066,0.025%,,United States,,32620,,
REXR^C,Rexford Industrial Realty Inc. 5.625% Series C Cumulative Redeemable Preferred Stock par value $0.01 per share,$26.50,-0.02,-0.075%,,United States,,3073,,
REZI,Resideo Technologies Inc. Common Stock ,$28.83,0.24,0.839%,4126711064.00,,2018,282787,Capital Goods,Wholesale Distributors
RF,Regions Financial Corporation Common Stock,$20.88,-0.35,-1.649%,20058873788.00,United States,,5840359,Finance,Major Banks
RF^A,Regions Financial Corporation Depositary Shares Representing 1/40th Perpetual Preferred Series A,$26.3007,0.0507,0.193%,,United States,,10315,,
RF^B,Regions Financial Corporation Depositary Shares Representing 1/40th Perpetual Preferred Series B,$28.95,0.09,0.312%,,United States,,20143,,
RF^C,Regions Financial Corporation Depositary Shares each Representing a 1/40th Interest in a  Share of 5.700% Fixed-to-Floating Rate Non-Cumulative  Perpetual Preferred Stock Series C,$27.70,0.11,0.399%,,United States,,40621,,
RFI,Cohen & Steers Total Return Realty Fund Inc. Common Stock,$14.9463,0.0163,0.109%,392349328.00,United States,1993,56383,,
RFL,Rafael Holdings Inc. Class B Common Stock,$39.76,-1.09,-2.668%,662864247.00,United States,2018,40790,Finance,Real Estate
RFM,RiverNorth Flexible Municipal Income Fund Inc. Common Stock,$22.78,-0.095,-0.415%,139292843.00,,2020,4466,,
RFMZ,RiverNorth Flexible Municipal Income Fund II Inc. Common Stock,$20.05,0.04,0.20%,0.00,,2021,29261,,
RFP,Resolute Forest Products Inc. Common Stock,$12.72,0.27,2.169%,1015447115.00,Canada,,612030,Basic Industries,Paper
RGA,Reinsurance Group of America Incorporated Common Stock,$130.98,-2.25,-1.689%,8904707128.00,United States,,252386,Finance,Life Insurance
RGR,Sturm Ruger & Company Inc. Common Stock,$70.18,-0.53,-0.75%,1233918164.00,United States,,107665,Capital Goods,Ordnance And Accessories
RGS,Regis Corporation Common Stock,$12.62,-0.22,-1.713%,489146985.00,United States,1991,70344,Consumer Services,Other Consumer Services
RGT,Royce Global Value Trust Inc. Common Stock,$14.81,0.17,1.161%,82947715.00,,2013,6891,,
RH,RH Common Stock,$617.46,14.79,2.454%,12964694625.00,United States,2012,237914,Consumer Services,Other Specialty Stores
RHI,Robert Half International Inc. Common Stock,$82.04,-0.85,-1.025%,9280763022.00,United States,,312865,Technology,Professional Services
RHP,Ryman Hospitality Properties Inc. (REIT),$76.065,-0.065,-0.085%,4187367297.00,United States,,257541,Consumer Services,Real Estate Investment Trusts
RICE,Rice Acquisition Corp. Class A Common Stock,$14.71,0.07,0.478%,436281684.00,United States,2020,341605,Finance,Business Services
RIG,Transocean Ltd (Switzerland) Common Stock,$3.445,-0.115,-3.23%,2126559589.00,Switzerland,,8537421,Energy,Oil & Gas Production
RIO,Rio Tinto Plc Common Stock,$83.83,2.11,2.582%,135711774203.00,Australia,2002,1788180,Basic Industries,Precious Metals
RIV,RiverNorth Opportunities Fund Inc. Common Stock,$17.58,-0.20,-1.125%,178561818.00,,2015,96934,,
RJF,Raymond James Financial Inc. Common Stock,$130.15,0.80,0.618%,17923106433.00,United States,,276914,Finance,Investment Bankers/Brokers/Service
RKT,Rocket Companies Inc. Class A Common Stock,$22.595,0.345,1.551%,44838737927.00,United States,2020,8416758,Finance,Finance: Consumer Services
RL,Ralph Lauren Corporation Common Stock,$126.40,0.61,0.485%,9242161462.00,United States,1997,268087,Consumer Non-Durables,Apparel
RLGY,Realogy Holdings Corp. Common Stock,$15.7426,0.1626,1.044%,1838967474.00,United States,2012,422832,Finance,Real Estate
RLI,RLI Corp. Common Stock (DE),$114.50,-0.06,-0.052%,5171458910.00,United States,,34740,Finance,Property-Casualty Insurers
RLJ,RLJ Lodging Trust Common Shares of Beneficial Interest $0.01 par value,$15.665,-0.115,-0.729%,2583442444.00,United States,2011,227304,Consumer Services,Real Estate Investment Trusts
RLJ^A,RLJ Lodging Trust $1.95 Series A Cumulative Convertible  Preferred Shares,$28.51,0.04,0.14%,,United States,,26330,,
RLX,RLX Technology Inc. American Depositary Shares each representing the right to receive one (1) Class A ordinary share,$9.155,-0.045,-0.489%,14380587668.00,,2021,2317386,Consumer Non-Durables,Farming/Seeds/Milling
RM,Regional Management Corp. Common Stock,$38.63,0.24,0.625%,419767487.00,United States,2012,24287,Finance,Finance: Consumer Services
RMAX,RE/MAX Holdings Inc. Class A Common Stock,$38.83,0.25,0.648%,1209003968.00,,2013,37624,Finance,Real Estate
RMD,ResMed Inc. Common Stock,$204.36,-3.32,-1.599%,29736236406.00,United States,,369567,Health Care,Medical/Dental Instruments
RMI,RiverNorth Opportunistic Municipal Income Fund Inc. Common Stock,$22.48,0.08,0.357%,143271065.00,,2018,14972,,
RMM,RiverNorth Managed Duration Municipal Income Fund Inc. Common Stock,$19.20,-0.07,-0.363%,378998726.00,,2019,35032,,
RMO,Romeo Power Inc. Class A Common Stock,$8.39,-0.51,-5.73%,1070244014.00,,2019,6536606,Capital Goods,Auto Parts:O.E.M.
RMPL^,RiverNorth Specialty Finance Corporation 5.875% ,$25.47,-0.09,-0.352%,,,,1113,,
RMT,Royce Micro-Cap Trust Inc. Common Stock,$11.79,0.02,0.17%,515986851.00,United States,,64240,,
RNG,RingCentral Inc. Class A Common Stock,$328.6919,9.3219,2.919%,29744163922.00,,2013,362636,Technology,EDP Services
RNGR,Ranger Energy Services Inc. Class A Common Stock,$5.745,0.245,4.455%,88581500.00,United States,2017,9861,Energy,Oilfield Services/Equipment
RNP,Cohen & Steers REIT and Preferred and Income Fund Inc. Common Shares,$24.81,0.03,0.121%,1180514208.00,United States,2003,66825,,
RNR,RenaissanceRe Holdings Ltd. Common Stock,$171.97,0.59,0.344%,8557467442.00,Bermuda,,197500,Finance,Property-Casualty Insurers
RNR^E,RenaissanceRe Holdings Ltd. 5.375% Series E Preference Shares,$25.35,-0.10,-0.393%,,Bermuda,,2579,,
RNR^F,RenaissanceRe Holdings Ltd. Depositary Shares each Representing a 1/1000th Interest in a 5.750% Series F Preference Share,$27.685,0.075,0.272%,,Bermuda,,7391,,
ROG,Rogers Corporation Common Stock,$192.31,0.93,0.486%,3591703292.00,United States,,8241,Basic Industries,Major Chemicals
ROK,Rockwell Automation Inc. Common Stock,$263.60,4.00,1.541%,30618479352.00,United States,,346981,Capital Goods,Industrial Machinery/Components
ROL,Rollins Inc. Common Stock,$35.1188,0.4188,1.207%,17282991269.00,United States,,485537,Finance,Diversified Commercial Services
ROP,Roper Technologies Inc. Common Stock,$423.67,4.67,1.115%,44459759061.00,United States,1992,173164,Capital Goods,Industrial Machinery/Components
ROT,Rotor Acquisition Corp. Class A Common Stock,$9.93,0.00,0.00%,342585000.00,,2021,190770,Finance,Business Services
RPAI,Retail Properties of America Inc. Class A Common Stock,$11.43,0.49,4.479%,2454393138.00,United States,2012,1222620,Consumer Services,Real Estate Investment Trusts
RPM,RPM International Inc. Common Stock,$90.83,0.24,0.265%,11763514467.00,United States,,271385,Basic Industries,Paints/Coatings
RPT,RPT Realty Common Stock,$12.16,0.35,2.964%,986084885.00,United States,,203062,Consumer Services,Real Estate Investment Trusts
RPT^D,RPT Realty 7.25% ,$55.00,-0.02,-0.036%,,United States,,2542,,
RQI,Cohen & Steers Quality Income Realty Fund Inc Common Shares,$14.38,0.15,1.054%,1930417633.00,United States,2002,254846,,
RRC,Range Resources Corporation Common Stock,$9.57,0.05,0.525%,2446903814.00,United States,,1903340,Energy,Oil & Gas Production
RRD,R.R. Donnelley & Sons Company Common Stock,$4.49,-0.03,-0.664%,320637922.00,United States,,487561,Miscellaneous,Publishing
RS,Reliance Steel & Aluminum Co. Common Stock (DE),$154.81,-0.73,-0.469%,9862551109.00,United States,1994,152728,Basic Industries,Metal Fabrications
RSF,RiverNorth Specialty Finance Corporation,$18.12,-0.08,-0.44%,93636894.00,,2019,23861,,
RSG,Republic Services Inc. Common Stock,$103.985,0.525,0.507%,33171100617.00,United States,1998,526598,Public Utilities,Environmental Services
RSI,Rush Street Interactive Inc. Class A Common Stock,$14.18,-0.83,-5.53%,3015574655.00,,2020,1130750,Consumer Services,Services-Misc. Amusement & Recreation
RTP,Reinvent Technology Partners Class A Ordinary Shares,$10.06,-0.05,-0.495%,867675000.00,United States,2020,1136327,Capital Goods,Aerospace
RTPZ,Reinvent Technology Partners Z Class A Ordinary Shares,$10.00,-0.03,-0.299%,287500000.00,United States,2021,134793,Finance,Property-Casualty Insurers
RTX,Raytheon Technologies Corporation Common Stock,$78.03,0.07,0.09%,118296049294.00,United States,,3178698,Capital Goods,Aerospace
RVI,Retail Value Inc. Common Stock ,$18.97,0.12,0.637%,399949290.00,United States,2018,97622,Finance,Real Estate
RVLV,Revolve Group Inc. Class A Common Stock,$51.25,-0.65,-1.252%,3672857644.00,,2019,366460,Consumer Services,Catalog/Specialty Distribution
RVT,Royce Value Trust Inc. Common Stock,$18.7699,0.0999,0.535%,1914017325.00,United States,1986,149530,,
RWT,Redwood Trust Inc. Common Stock,$10.2841,-0.0159,-0.154%,1161931268.00,United States,1995,536194,Consumer Services,Real Estate Investment Trusts
RXN,Rexnord Corporation Common Stock,$48.77,0.35,0.723%,5833572976.00,United States,2012,165201,Technology,Industrial Machinery/Components
RY,Royal Bank Of Canada Common Stock,$93.97,0.20,0.213%,133893464225.00,Canada,,593393,Finance,Commercial Banks
RY^T,Royal Bank Of Canada 6.750% Fixed Rate/Floating Rate Noncumulative First Preferred Shares Series C-2,$28.8215,0.1124,0.392%,,Canada,,134,,
RYAM,Rayonier Advanced Materials Inc. Common Stock,$9.215,0.105,1.153%,585914138.00,United States,2014,498821,Basic Industries,Paper
RYB,RYB Education Inc. American depositary shares each representing one Class A ordinary share,$2.75,-0.07,-2.482%,75862452.00,,2017,113774,Consumer Services,Other Consumer Services
