Symbol,Name,Last Sale,Net Change,% Change,Market Cap,Country,IPO Year,Volume,Sector,Industry
A,Agilent Technologies Inc. Common Stock,$133.40,1.43,1.084%,40646648501.00,United States,1999,1399699,Capital Goods,Biotechnology: Laboratory Analytical Instruments
AA,Alcoa Corporation Common Stock ,$32.68,-0.71,-2.126%,6088976391.00,,2016,3937281,Basic Industries,Aluminum
AAC,Ares Acquisition Corporation Class A Ordinary Shares,$9.895,-0.005,-0.051%,1236998688.00,,2021,103988,Finance,Business Services
AAIC,Arlington Asset Investment Corp Class A (new),$3.99,0.01,0.251%,133283017.00,United States,,108862,Consumer Services,Real Estate Investment Trusts
AAIC^B,Arlington Asset Investment Corp 7.00% ,$23.90,0.00,0.00%,,United States,,301,,
AAIC^C,Arlington Asset Investment Corp 8.250% Seies C Fixed-to-Floating Rate Cumulative Redeemable Preferred Stock   ,$23.7939,0.0039,0.016%,,United States,,1936,,
AAN,Aarons Holdings Company Inc. Common Stock ,$24.95,0.09,0.362%,853412529.00,United States,2020,75429,Technology,Diversified Commercial Services
AAP,Advance Auto Parts Inc Advance Auto Parts Inc W/I,$189.28,1.51,0.804%,12384937540.00,United States,,352940,Consumer Services,Other Specialty Stores
AAT,American Assets Trust Inc. Common Stock,$33.89,0.50,1.497%,2049405773.00,United States,2011,141581,Consumer Services,Real Estate Investment Trusts
AB,AllianceBernstein Holding L.P.  Units,$39.99,-0.36,-0.892%,3927935451.00,United States,,428377,Finance,Investment Managers
ABB,ABB Ltd Common Stock,$32.90,1.31,4.147%,66594852419.00,Switzerland,,1056060,Consumer Durables,Electrical Products
ABBV,AbbVie Inc. Common Stock,$106.83,0.93,0.878%,188536340748.00,United States,2012,3419234,Health Care,Major Pharmaceuticals
ABC,AmerisourceBergen Corporation Common Stock,$118.72,0.72,0.61%,24302714128.00,United States,,707923,Health Care,Other Pharmaceuticals
ABEV,Ambev S.A. American Depositary Shares (Each representing 1 Common Share),$2.85,0.03,1.064%,44856843411.00,,2013,11446649,Consumer Non-Durables,Beverages (Production/Distribution)
ABG,Asbury Automotive Group Inc Common Stock,$215.9996,6.1996,2.955%,4174950861.00,United States,2002,163922,Consumer Durables,Automotive Aftermarket
ABM,ABM Industries Incorporated Common Stock,$53.105,-0.295,-0.552%,3562798306.00,United States,,103951,Finance,Diversified Commercial Services
ABR,Arbor Realty Trust Common Stock,$16.44,0.00,0.00%,2197864586.00,United States,2004,457440,Consumer Services,Real Estate Investment Trusts
ABR^A,Arbor Realty Trust Preferred Series A,$26.1322,0.00,0.00%,,United States,,6,,
ABR^B,Arbor Realty Trust Cumulative Redeemable Preferred Series B,$25.9499,-0.0001,0.00%,,United States,,1397,,
ABR^C,Arbor Realty Trust Cumulative Redeemable Preferred Series C,$26.075,0.085,0.327%,,United States,,4693,,
ABT,Abbott Laboratories Common Stock,$124.06,2.56,2.107%,219775932153.00,United States,,2919239,Health Care,Major Pharmaceuticals
AC,Associated Capital Group Inc. Common Stock,$34.37,1.17,3.524%,763434242.00,United States,2015,4739,Finance,Investment Bankers/Brokers/Service
ACA,Arcosa Inc. Common Stock ,$63.32,0.27,0.428%,3050428146.00,,2018,118727,Capital Goods,Metal Fabrications
ACB,Aurora Cannabis Inc. Common Shares,$7.85,-0.13,-1.629%,1554140975.00,,2018,6166654,Consumer Durables,Specialty Chemicals
ACC,American Campus Communities Inc Common Stock,$43.80,0.60,1.389%,6038521690.00,United States,2004,176258,Consumer Services,Real Estate Investment Trusts
ACCO,Acco Brands Corporation Common Stock,$8.82,0.05,0.57%,842184059.00,United States,,113868,Consumer Durables,Publishing
ACEL,Accel Entertainment Inc. ,$11.68,0.19,1.654%,1129606333.00,United States,2017,101067,Consumer Services,Services-Misc. Amusement & Recreation
ACH,Aluminum Corporation of China Limited American Depositary Shares,$12.445,0.545,4.58%,8473886595.00,China,2001,136938,Basic Industries,Aluminum
ACI,Albertsons Companies Inc. Class A Common Stock,$19.285,-0.425,-2.156%,8977808881.00,United States,2020,1853259,Consumer Services,Food Chains
ACIC,Atlas Crest Investment Corp. Class A Common Stock,$9.94,-0.07,-0.699%,621250000.00,United States,2020,1504924,Capital Goods,Aerospace
ACII,Atlas Crest Investment Corp. II Class A Common Stock,$10.07,0.005,0.05%,434268750.00,,2021,267047,Finance,Business Services
ACM,AECOM Common Stock,$67.31,0.88,1.325%,9946702739.00,United States,2007,740487,Consumer Services,Military/Government/Technical
ACN,Accenture plc Class A Ordinary Shares (Ireland),$285.21,0.77,0.271%,181292939338.00,Ireland,2001,867787,Miscellaneous,Business Services
ACND,Ascendant Digital Acquisition Corp. Class A Ordinary Shares,$9.93,0.00,0.00%,513877500.00,United States,2020,64731,Technology,Computer Software: Prepackaged Software
ACP,Aberdeen Income Credit Strategies Fund Common Shares,$12.15,0.17,1.419%,211799966.00,United States,2011,108058,,
ACR,ACRES Commercial Realty Corp. Common Stock,$15.50,0.01,0.065%,146920579.00,United States,,32147,Consumer Services,Real Estate Investment Trusts
ACR^C,ACRES Commercial Realty Corp. 8.625% Fixed-to-Floating Series C Cumulative Redeemable Preferred Stock ,$24.70,0.13,0.529%,,United States,,7804,,
ACRE,Ares Commercial Real Estate Corporation Common Stock,$14.40,0.11,0.77%,582880910.00,United States,2012,254347,Consumer Services,Real Estate Investment Trusts
ACV,Virtus AllianzGI Diversified Income & Convertible Fund Common Shares of Beneficial Interest,$33.6493,0.3593,1.079%,348402160.00,United States,2015,21684,,
ADC,Agree Realty Corporation Common Stock,$68.70,1.22,1.808%,4367465718.00,United States,,483974,Consumer Services,Real Estate Investment Trusts
ADCT,ADC Therapeutics SA Common Shares,$23.58,-0.76,-3.122%,1809097615.00,,2020,89197,Health Care,Major Pharmaceuticals
ADEX,Adit EdTech Acquisition Corp. Common Stock,$9.818,-0.012,-0.122%,0.00,,2021,126092,Finance,Business Services
ADM,Archer-Daniels-Midland Company Common Stock,$58.71,0.16,0.273%,32789568054.00,United States,,669975,Consumer Non-Durables,Packaged Foods
ADNT,Adient plc Ordinary Shares ,$45.46,0.81,1.814%,4280973155.00,,2016,266182,Capital Goods,Auto Parts:O.E.M.
ADS,Alliance Data Systems Corporation Common Stock,$107.19,-0.45,-0.418%,5326812517.00,United States,2001,823353,Miscellaneous,Business Services
ADT,ADT Inc. Common Stock,$9.46,0.14,1.502%,7848212900.00,United States,2018,1249687,Consumer Services,Diversified Commercial Services
ADX,Adams Diversified Equity Fund Inc.,$19.185,0.175,0.921%,2129245345.00,United States,,109354,,
AEB,AEGON N.V. Perp. Cap. Secs. Floating Rate (Netherlands),$25.41,-0.02,-0.079%,0.00,Netherlands,,6250,Finance,Life Insurance
AEE,Ameren Corporation Common Stock,$83.29,0.67,0.811%,21273098650.00,United States,,656517,Public Utilities,Power Generation
AEFC,Aegon Funding Company LLC 5.10% Subordinated Notes due 2049,$26.55,-0.02,-0.075%,0.00,,2019,28478,Finance,Life Insurance
AEG,AEGON N.V. Common Stock,$4.59,-0.07,-1.502%,9695958118.00,Netherlands,,910509,Finance,Life Insurance
AEL,American Equity Investment Life Holding Company Common Stock,$31.565,0.175,0.558%,3012373926.00,United States,2003,259860,Finance,Life Insurance
AEL^A,American Equity Investment Life Holding Company Depositary Shares each representing a 1/1000th interest in a share of 5.95% Fixed-Rate Reset Non-Cumulative Preferred Stock Series A,$26.76,-0.06,-0.224%,,United States,,9179,,
AEL^B,American Equity Investment Life Holding Company Depositary Shares each representing a 1/1000th interest in a share of 6.625% Fixed-Rate Reset Non-Cumulative Preferred Stock Series B,$27.60,0.0573,0.208%,,United States,,8716,,
AEM,Agnico Eagle Mines Limited Common Stock,$63.83,3.03,4.984%,15555074765.00,Canada,,1482174,Basic Industries,Precious Metals
AENZ,Aenza S.A.A. American Depositary Shares,$2.26,0.10,4.63%,394106870.00,,2018,967,Basic Industries,Military/Government/Technical
AEO,American Eagle Outfitters Inc. Common Stock,$34.275,1.295,3.927%,5713671017.00,United States,,7793609,Consumer Services,Clothing/Shoe/Accessory Stores
AER,AerCap Holdings N.V. Ordinary Shares,$61.09,-0.14,-0.229%,7966046686.00,Netherlands,2006,719130,Technology,Diversified Commercial Services
AES,The AES Corporation Common Stock,$28.555,0.185,0.652%,19077934962.00,United States,,2584231,Basic Industries,Electric Utilities: Central
AESC,The AES Corporation Corporate Units,$108.53,1.01,0.939%,0.00,United States,,19349,Basic Industries,Electric Utilities: Central
AEVA,Aeva Technologies Inc. Common Stock,$9.81,-0.84,-7.887%,304654455.00,,2020,2571554,Capital Goods,Auto Parts:O.E.M.
AFB,AllianceBernstein National Municipal Income Fund Inc,$14.43,0.06,0.418%,414789426.00,United States,2002,35162,,
AFG,American Financial Group Inc. Common Stock,$118.80,-0.27,-0.227%,10122489313.00,United States,,118291,Finance,Property-Casualty Insurers
AFGB,American Financial Group Inc. 5.875% Subordinated Debentures due 2059,$28.437,-0.073,-0.256%,0.00,United States,2019,5996,Finance,Property-Casualty Insurers
AFGC,American Financial Group Inc. 5.125% Subordinated Debentures due 2059,$27.3879,-0.0421,-0.153%,27334767.00,United States,2019,9001,Finance,Property-Casualty Insurers
AFGD,American Financial Group Inc. 5.625% Subordinated Debentures due 2060,$28.30,0.07,0.248%,0.00,United States,2020,5018,Finance,Property-Casualty Insurers
AFGE,American Financial Group Inc. 4.500% Subordinated Debentures due 2060,$26.91,-0.07,-0.259%,0.00,United States,2020,1017,Finance,Property-Casualty Insurers
AFI,Armstrong Flooring Inc. Common Stock,$5.02,-0.10,-1.953%,108757351.00,,2016,218747,Consumer Non-Durables,Plastic Products
AFL,AFLAC Incorporated Common Stock,$52.78,-0.09,-0.17%,36291536234.00,United States,,1269026,Finance,Accident &Health Insurance
AFT,Apollo Senior Floating Rate Fund Inc. Common Stock,$15.285,0.035,0.23%,238034237.00,,2011,39657,,
AG,First Majestic Silver Corp. Ordinary Shares (Canada),$17.0113,0.8213,5.073%,3788095524.00,Canada,,4251857,Basic Industries,Precious Metals
AGAC,African Gold Acquisition Corporation Class A Ordinary Shares,$9.68,0.00,0.00%,500940000.00,,2021,11141,Finance,Business Services
AGCB,Altimeter Growth Corp. 2 Class A Ordinary Shares,$10.60,-0.43,-3.898%,607910000.00,,2021,210988,Finance,Business Services
AGCO,AGCO Corporation Common Stock,$150.81,0.16,0.106%,11354955880.00,United States,,212586,Capital Goods,Industrial Machinery/Components
AGD,Aberdeen Global Dynamic Dividend Fund,$11.55,0.02,0.173%,144947661.00,United States,2006,33080,,
AGI,Alamos Gold Inc. Class A Common Shares,$8.73,0.45,5.435%,3428941656.00,Canada,2015,2080659,Basic Industries,Precious Metals
AGL,agilon health inc.,$30.43,30.43,,0.00,,,10853283,,
AGM,Federal Agricultural Mortgage Corporation Common Stock,$98.52,-0.37,-0.374%,1057822639.00,United States,,10298,Finance,Finance Companies
AGM^C,Federal Agricultural Mortgage Corporation Preferred Series C Fixed to Fltg,$27.62,0.00,0.00%,,United States,,20,,
AGM^D,Federal Agricultural Mortgage Corporation 5.700% Non-Cumulative Preferred Stock Series D,$27.0139,0.0139,0.051%,,United States,,543,,
AGM^E,Federal Agricultural Mortgage Corporation 5.750% Non-Cumulative Preferred Stock Series E,$27.00,0.09,0.334%,,United States,,1299,,
AGM^F,Federal Agricultural Mortgage Corporation 5.250% Non-Cumulative Preferred Stock Series F,$26.39,-0.11,-0.415%,,United States,,9982,,
AGO,Assured Guaranty Ltd. Common Stock,$45.32,0.19,0.421%,3459727304.00,Bermuda,2004,130984,Finance,Property-Casualty Insurers
AGO^B,Assured Guaranty Ltd.,$26.8696,0.1996,0.748%,,Bermuda,,20231,,
AGO^E,Assured Guaranty Ltd.,$26.403,-0.217,-0.815%,,Bermuda,,3543,,
AGO^F,Assured Guaranty Ltd.,$25.801,0.091,0.354%,,Bermuda,,2783,,
AGR,Avangrid Inc. Common Stock,$52.41,0.32,0.614%,16214165084.00,United States,2015,335951,Public Utilities,Electric Utilities: Central
AGRO,Adecoagro S.A. Common Shares,$8.96,0.29,3.345%,1050982339.00,Luxembourg,2011,703236,Consumer Non-Durables,Farming/Seeds/Milling
AGS,PlayAGS Inc. Common Stock,$7.75,-0.18,-2.27%,282389277.00,United States,2018,105892,Consumer Durables,Miscellaneous manufacturing industries
AGX,Argan Inc. Common Stock,$53.60,-0.51,-0.943%,840982338.00,United States,,76214,Basic Industries,Engineering & Construction
AHC,A.H. Belo Corporation (TX) Common Stock,$2.29,-0.05,-2.137%,49029869.00,United States,,68776,Consumer Services,Newspapers/Magazines
AHH,Armada Hoffler Properties Inc. Common Stock,$13.60,0.65,5.019%,806426090.00,United States,2013,232624,Finance,Real Estate
AHH^A,Armada Hoffler Properties Inc. 6.75% Series A Cumulative Redeemable Perpetual Preferred Stock,$26.621,-0.249,-0.927%,,United States,,76119,,
AHL^C,Aspen Insurance Holdings Limited 5.95% Fixed-to-Floating Rate Perpetual Non-Cumulative Preference Shares,$27.105,0.055,0.203%,,Bermuda,,7304,,
AHL^D,Aspen Insurance Holdings Limited 5.625% Perpetual Non-Cumulative Preference Shares,$27.00,0.08,0.297%,,Bermuda,,7244,,
AHL^E,Aspen Insurance Holdings Limited Depositary Shares each representing a 1/1000th interest in a share of 5.625% Perpetual Non-Cumulative Preference Shares,$26.44,0.03,0.114%,,Bermuda,,8988,,
AHT,Ashford Hospitality Trust Inc Common Stock,$1.93,-0.21,-9.813%,221111706.00,United States,2003,15121853,Consumer Services,Real Estate Investment Trusts
AHT^D,Ashford Hospitality Trust Inc 8.45% Series D Cumulative Preferred Stock,$23.919,-0.111,-0.462%,,United States,,14782,,
AHT^F,Ashford Hospitality Trust Inc 7.375% Series F Cumulative Preferred Stock,$23.85,-0.49,-2.013%,,United States,,11128,,
AHT^G,Ashford Hospitality Trust Inc 7.375% Series G Cumulative Preferred Stock,$23.47,-0.57,-2.371%,,United States,,36879,,
AHT^H,Ashford Hospitality Trust Inc 7.50% Series H Cumulative Preferred Stock,$24.00,-0.12,-0.498%,,United States,,9988,,
AHT^I,Ashford Hospitality Trust Inc 7.50% Series I Cumulative Preferred Stock,$24.00,-0.13,-0.539%,,United States,,23860,,
AI,C3.ai Inc. Class A Common Stock,$66.10,-2.36,-3.447%,6671583189.00,,2020,5406242,Technology,Computer Software: Prepackaged Software
AIC,Arlington Asset Investment Corp 6.750% Notes due 2025,$25.155,-0.1203,-0.476%,0.00,United States,2015,367,Consumer Services,Real Estate Investment Trusts
AIF,Apollo Tactical Income Fund Inc. Common Stock,$15.34,0.08,0.524%,221878159.00,,2013,22165,,
AIG,American International Group Inc. New Common Stock,$46.645,-0.845,-1.779%,40185867862.00,United States,,2111993,Finance,Property-Casualty Insurers
AIG^A,American International Group Inc. Depositary Shares Each Representing a 1/1000th Interest in a Share of Series A 5.85% Non-Cumulative Perpetual Preferred Stock,$28.07,0.17,0.609%,,United States,,28285,,
AIN,Albany International Corporation Common Stock,$86.43,-0.22,-0.254%,2797589576.00,United States,,30093,Basic Industries,Textiles
AIO,Virtus AllianzGI Artificial Intelligence & Technology Opportunities Fund Common Shares,$27.75,0.05,0.181%,952466996.00,,2019,131370,,
AIR,AAR Corp. Common Stock,$40.885,-0.195,-0.475%,1444037267.00,United States,,81694,Capital Goods,Aerospace
AIRC,Apartment Income REIT Corp. Common Stock,$44.10,1.27,2.965%,6570271134.00,,2020,161427,Consumer Services,Real Estate Investment Trusts
AIT,Applied Industrial Technologies Inc. Common Stock,$94.325,0.795,0.85%,3662832739.00,United States,,22134,Consumer Durables,Industrial Specialties
AIV,Apartment Investment and Management Company Common Stock,$6.315,0.115,1.855%,942251545.00,United States,1994,1318737,Consumer Services,Real Estate Investment Trusts
AIW,Arlington Asset Investment Corp 6.625% Notes due 2023,$25.39,-0.20,-0.782%,0.00,United States,,2081,Consumer Services,Real Estate Investment Trusts
AIZ,Assurant Inc. Common Stock,$150.03,0.53,0.355%,9079668571.00,United States,2004,219665,Finance,Property-Casualty Insurers
AIZN,Assurant Inc. 5.25% Subordinated Notes due 2061,$26.205,0.045,0.172%,0.00,United States,2020,5607,Finance,Property-Casualty Insurers
AJAX,Ajax I Class A Ordinary Shares,$10.065,-0.045,-0.445%,900248153.00,United States,2020,557601,Finance,Business Services
AJG,Arthur J. Gallagher & Co. Common Stock,$134.655,1.675,1.26%,26282815131.00,United States,,252483,Finance,Specialty Insurers
AJRD,Aerojet Rocketdyne Holdings Inc. Common Stock,$48.25,0.41,0.857%,3861866358.00,United States,,222099,Capital Goods,Military/Government/Technical
AJX,Great Ajax Corp. Common Stock,$11.50,0.02,0.174%,264250899.00,United States,2015,46205,Consumer Services,Real Estate Investment Trusts
AJXA,Great Ajax Corp. 7.25% Convertible Senior Notes due 2024,$25.3678,0.0978,0.387%,0.00,United States,2017,1413,Consumer Services,Real Estate Investment Trusts
AKO/A,Embotelladora Andina S.A.,$14.30,0.00,0.00%,,Chile,,8,,
AKO/B,Embotelladora Andina S.A.,$15.96,0.52,3.368%,,Chile,,2413,,
AKR,Acadia Realty Trust Common Stock,$20.16,0.57,2.91%,1739861303.00,United States,,143129,Consumer Services,Real Estate Investment Trusts
AL,Air Lease Corporation Class A Common Stock,$49.185,0.535,1.10%,5611559047.00,United States,2011,305339,Technology,Diversified Commercial Services
AL^A,Air Lease Corporation 6.150% Fixed-to-Floating Rate Non-Cumulative Perpetual Preferred Stock Series A,$26.27,-0.46,-1.721%,,United States,,2789,,
ALB,Albemarle Corporation Common Stock,$149.75,-3.18,-2.079%,17478532330.00,United States,,587485,Basic Industries,Major Chemicals
ALC,Alcon Inc. Ordinary Shares,$74.03,0.74,1.01%,36992791000.00,Switzerland,2019,330789,Health Care,Ophthalmic Goods
ALE,Allete Inc.,$70.01,-0.15,-0.214%,3653365015.00,United States,,103778,Public Utilities,Power Generation
ALEX,Alexander & Baldwin Inc. Common Stock REIT Holding Company,$17.51,0.16,0.922%,1268944132.00,United States,,86316,Consumer Services,Real Estate Investment Trusts
ALG,Alamo Group Inc. Common Stock,$158.51,0.09,0.057%,1886137278.00,United States,,5522,Capital Goods,Industrial Machinery/Components
ALIN^A,Altera Infrastructure L.P. 7.25% Series A ,$21.60,0.20,0.935%,,Bermuda,,5245,,
ALIN^B,Altera Infrastructure L.P. 8.50% Series B ,$23.265,0.0052,0.022%,,Bermuda,,23523,,
ALIN^E,Altera Infrastructure L.P. 8.875% Series E ,$23.10,0.01,0.043%,,Bermuda,,6403,,
ALK,Alaska Air Group Inc. Common Stock,$69.52,-1.05,-1.488%,8647496515.00,United States,,1313481,Transportation,Air Freight/Delivery Services
ALL,Allstate Corporation (The) Common Stock,$121.355,0.935,0.776%,36447960329.00,United States,,1097765,Finance,Property-Casualty Insurers
ALL^B,Allstate Corporation (The) 5.100% Fixed-to-Floating Rate Subordinated Debentures due 2053,$26.77,0.18,0.677%,,United States,,8856,,
ALL^G,Allstate Corporation (The) Depositary Shares each representing a 1/1000th interest in a share of Fixed Rate Noncumulative Perpetual Preferred Stock Series G,$27.91,0.12,0.432%,,United States,,21027,,
ALL^H,Allstate Corporation (The) Depositary Shares each representing a 1/1000th interest in a share of Fixed Rate Noncumulative Perpetual Preferred Stock Series H,$27.095,0.065,0.24%,,United States,,49652,,
ALL^I,Allstate Corporation (The) Depositary Shares each representing a 1/1000th interest in a share of Fixed Rate Noncumulative Perpetual Preferred Stock Series I,$26.82,0.08,0.299%,,United States,,8914,,
ALLE,Allegion plc Ordinary Shares,$130.17,-0.07,-0.054%,11810623100.00,United States,2013,329497,Consumer Services,Diversified Commercial Services
ALLY,Ally Financial Inc. Common Stock,$47.62,-0.13,-0.272%,17775185401.00,United States,2014,2084078,Finance,Major Banks
ALLY^A,GMAC Capital Trust I Fixed Rate Floating Rate Trust Preferred Securities Series 2,$25.59,0.03,0.117%,,United States,,91179,,
ALP^Q,Alabama Power Company 5.00% Class A Preferred Stock Cumulative Par Value $1 Per Share (Stated Capital $25 Per Share),$26.67,-0.03,-0.112%,,United States,,36843,,
ALSN,Allison Transmission Holdings Inc. Common Stock,$44.84,1.48,3.413%,4982486997.00,United States,2012,490003,Capital Goods,Auto Parts:O.E.M.
ALTG,Alta Equipment Group Inc. Class A Common Stock,$13.42,0.04,0.299%,402848297.00,,2019,50345,Capital Goods,Industrial Machinery/Components
ALTG^A,Alta Equipment Group Inc. Depositary Shares (each representing 1/1000th in a share of 10% Series A Cumulative Perpetual Preferred Stock),$27.3806,0.1406,0.516%,,,,3842,,
ALUS,Alussa Energy Acquisition Corp. Class A Ordinary Shares,$9.97,-0.13,-1.287%,358296875.00,,2020,1183339,Finance,Business Services
ALV,Autoliv Inc. Common Stock,$95.9775,0.7275,0.764%,8390553835.00,Sweden,,186012,Capital Goods,Auto Parts:O.E.M.
ALX,Alexander's Inc. Common Stock,$282.06,-4.38,-1.529%,1440562217.00,United States,,4233,Consumer Services,Real Estate Investment Trusts
AM,Antero Midstream Corporation Common Stock,$8.751,0.101,1.168%,4173412921.00,United States,2017,2073252,Public Utilities,Natural Gas Distribution
AMBC,Ambac Financial Group Inc. Common Stock,$17.37,0.14,0.813%,796422629.00,United States,,87306,Finance,Property-Casualty Insurers
AMC,AMC Entertainment Holdings Inc. Class A Common Stock,$9.775,0.425,4.545%,4400276718.00,,2013,38307583,Consumer Services,Movies/Entertainment
AMCR,Amcor plc Ordinary Shares,$11.905,0.165,1.405%,18595343899.00,,2019,1474209,Consumer Durables,Miscellaneous manufacturing industries
AME,AMETEK Inc.,$133.70,2.59,1.975%,30857935667.00,United States,,600719,Capital Goods,Industrial Machinery/Components
AMG,Affiliated Managers Group Inc. Common Stock,$157.89,1.11,0.708%,6729634947.00,United States,,136890,Finance,Investment Managers
AMH,American Homes 4 Rent Common Shares of Beneficial Interest,$34.55,0.25,0.729%,10947210066.00,,2013,1315312,Consumer Services,Real Estate Investment Trusts
AMH^D,American Homes 4 Rent 6.5% Series D Cumulative Perpetual Preferred Shares of Beneficial Interest,$25.42,-0.11,-0.431%,,,,4523,,
AMH^E,American Homes 4 Rent 6.35% Series E Cumulative Redeemable Perpetual Preferred Shares of Beneficial Interest,$25.47,-0.1322,-0.516%,,,,4801,,
AMH^F,American Homes 4 Rent 5.875% Series F Cumulative Redeemable Perpetual Preferred Shares,$26.16,-0.17,-0.646%,,,,25255,,
AMH^G,American Homes 4 Rent Series G cumulative redeemable perpetual preferred shares of beneficial interest,$26.155,-0.0654,-0.249%,,,,497,,
AMH^H,American Homes 4 Rent Series H cumulative redeemable perpetual Preferred Shares of Beneficial Interest,$27.16,-0.04,-0.147%,,,,50015,,
AMK,AssetMark Financial Holdings Inc. Common Stock,$22.41,-0.01,-0.045%,1623811905.00,United States,2019,5451,Finance,Investment Managers
AMN,AMN Healthcare Services Inc AMN Healthcare Services Inc,$76.475,0.875,1.157%,3608127132.00,United States,,49861,Technology,Professional Services
AMOV,America Movil S.A.B. de C.V. Class A American Depositary Shares,$14.18,0.16,1.141%,47177753794.00,Mexico,,2257,Public Utilities,Telecommunications Equipment
AMP,Ameriprise Financial Inc. Common Stock,$246.72,-0.21,-0.085%,28767375348.00,United States,,312017,Finance,Investment Managers
AMPY,Amplify Energy Corp. Common Stock,$2.55,-0.02,-0.778%,96821776.00,United States,2016,441048,Energy,Oil & Gas Production
AMR,Alpha Metallurgical Resources Inc. Common Stock,$14.55,-0.04,-0.274%,267561972.00,United States,2018,97139,Energy,Coal Mining
AMRC,Ameresco Inc. Class A Common Stock,$49.55,-2.05,-3.973%,2517957674.00,United States,2010,258600,Basic Industries,Engineering & Construction
AMRX,Amneal Pharmaceuticals Inc. Class A Common Stock,$5.89,0.07,1.203%,874234364.00,,2018,458192,Health Care,Major Pharmaceuticals
AMT,American Tower Corporation (REIT) Common Stock,$245.34,3.66,1.514%,109025277774.00,United States,,1117748,Consumer Services,Real Estate Investment Trusts
AMWL,American Well Corporation Class A Common Stock,$17.55,0.32,1.857%,4179090310.00,United States,2020,1552822,Miscellaneous,Business Services
AMX,America Movil S.A.B. de C.V. American Depository Receipt Series L,$14.295,0.235,1.671%,47560366042.00,Mexico,,1437767,Public Utilities,Telecommunications Equipment
AN,AutoNation Inc. Common Stock,$96.08,0.61,0.639%,7918959718.00,United States,,270659,Consumer Durables,Automotive Aftermarket
ANET,Arista Networks Inc. Common Stock,$313.67,1.20,0.384%,23942924503.00,,2014,168032,Technology,Computer Communications Equipment
ANF,Abercrombie & Fitch Company Common Stock,$39.90,1.13,2.915%,2478273827.00,United States,,1605606,Consumer Services,Clothing/Shoe/Accessory Stores
ANTM,Anthem Inc. Common Stock,$373.57,10.95,3.02%,91491598021.00,United States,,815251,Health Care,Medical Specialities
AOD,Aberdeen Total Dynamic Dividend Fund Common Stock,$9.735,0.015,0.154%,1026857516.00,United States,2007,511926,,
AON,Aon plc Class A Ordinary Shares (Ireland),$236.42,1.55,0.66%,53427219081.00,United States,,629956,Finance,Specialty Insurers
AONE,one Class A Ordinary Shares,$10.19,-0.29,-2.767%,273856250.00,United States,2020,600479,Technology,Computer peripheral equipment
AOS,A.O. Smith Corporation Common Stock,$67.205,-0.095,-0.141%,10858467766.00,United States,,344030,Consumer Durables,Consumer Electronics/Appliances
AP,Ampco-Pittsburgh Corporation Common Stock,$6.7899,-0.1401,-2.022%,127974867.00,United States,,17185,Capital Goods,Fluid Controls
APAM,Artisan Partners Asset Management Inc. Class A Common Stock,$56.81,2.87,5.321%,4509919626.00,United States,2013,845943,Finance,Investment Managers
APD,Air Products and Chemicals Inc. Common Stock,$287.255,4.375,1.547%,63562893037.00,United States,,290250,Basic Industries,Major Chemicals
APG,APi Group Corporation Common Stock,$22.035,0.165,0.754%,4421369420.00,,2020,288703,Basic Industries,Engineering & Construction
APGB,Apollo Strategic Growth Capital II Class A Ordinary Shares,$9.95,0.07,0.709%,858187500.00,,2021,89145,Finance,Business Services
APH,Amphenol Corporation Common Stock,$68.255,0.545,0.805%,40909107735.00,United States,,1234538,Capital Goods,Electrical Products
APLE,Apple Hospitality REIT Inc. Common Shares,$15.02,-0.03,-0.199%,3359317085.00,United States,2015,831792,Consumer Services,Real Estate Investment Trusts
